video_id,title,publishedAt,channelId,channelTitle,categoryId,trending_date,tags,view_count,likes,dislikes,comment_count,thumbnail_link,comments_disabled,ratings_disabled,description
"JpLPHDbNjvs","KRISHNASURA|| VREEGU KASHYAP-PRIYAM PALLABEE || PAPORI ||HRIDOY CHANDAN||ABHINANDAN THEATRE 2023-24","2023-08-26T10:55:27Z","UCCvaKYCnvpX1QH2ljQ9SCUg","Vreeguu Kaxyap VK Entertainment","24","23.28.08","[none]","222343","0","0","871","https://i.ytimg.com/vi/JpLPHDbNjvs/default.jpg","False","True","Team Krishnasuraa ❤️Audio Credits:Song: Krishnasura Singer: Vreegu Kashyap & Papori GogoiLyrics/Compose/Music: Hridoy ChandanMix-Mastered: Diganta BordoloiGuitar/Mandolin: Rishi ManiFlute: Anjan MedhiPiano: SukumarAdditional Vocal: Hridoy ChandanRecorded @Studio “VREEYAM” By Trion Mahanta & Studio “MAA” by Tarun Tanmay & Ajay Phukan Video Credits Starring - Podmarag Goswami , Priyam Pallabee , Parinita Deka & Vreegu KashyapSupported Actors - Bittu, Rupam Deka, Saidul, Director - Rintu Choudhury Asst - Munnaf & Gayotri BoroDOP - Bitul Das ( 3Days )& Parag Jyoti Das (1 Day )Asst - Anil Boro & Madhurjya Makeup - Riyan Kashyap, Asst - Uttara Das & ParagEditor - Manas Kashyap ( Cinedreams )Still Photograher - Bittu Tridip BarmanProduction Controller - Rupam Reeyan DekaSupported Actors - Bittu, Rupam Deka, Saidul Special Thanks 🙏Bikash Chetry & Team Ayub & DhrubaBiren Khakhlary & All the People of Panikhaiti Village.Prople of Chandubi VillageXukreshwar Mandir ComiteeJanardon Mandir ComiteeSankardev Film StudioJyotichtraban Film Studio  You Can also Listen by clicking all the link mentioned Below 👇 https://open.spotify.com/track/0x7pEyZ5l6J2YUYQEcFeYN?si=68780b55906541cchttps://music.apple.com/in/album/krishnasura/1704033801?i=1704033803&at=1000lHKX&ct=odesli_http&itsct=odsl_m&itscg=30200&ls=1https://music.youtube.com/watch?v=OXe1MkRyXe8https://www.jiosaavn.com/album/krishnasura/tmmj5wZRLIE_https://music.amazon.com/albums/B0CGLQBD77?trackAsin=B0CGLQ32DHhttps://wynk.in/u/KHQEkqmMVOk Social Media Handles of Vreegu Kashyap Instagram - https://www.instagram.com/p/CmS8xaLSCKl/?igshid=YmMyMTA2M2Y=Facebook Page - https://www.facebook.com/Vreegukk?mibextid=LQQJ4dFacebook Account - https://www.facebook.com/vreegu?mibextid=LQQJ4dBhrigu Kashyap (199K PLUS FOLLOWERS)WhatsApp - +91 87619 69399How May We Help You for Bookings👇+91 96783-36943Email - vreegukashyapliveenquiry@gmail.comLyrics 👇Lyrics 👇(১)বুকুতে ফুলিব ধৰিছে হেজাৰ ৰঙা গোলাপতোমাৰেই খোজতে ভাঁহিছে প্ৰণয়ৰ মিঠা সুবাস অ' আউলি বাউলী মোৰ মন তোমাতেই মগন আমাৰ প্রেমৰ হ'ব জানা শুভ মধুলগনঅ' আউলি বাউলী মোৰ মন তোমাতেই মগন আমাৰ প্রেমৰ হ'ব জানা শুভ মধুলগনজনম জনমলে হৈ ৰম তোমাৰে বুকুৰে সাঁচি পাতত লিখি লোৱা প্ৰতিটো পলতে থাকিম মই কাষতে তুমিয়েই মোৰ কৃষ্ণচূড়া(২) উকা দুচকুৰে তোমাক চালেসপোনৰে ৰং ভাহি আহে মনৰে গোপন কোঠালীতেমিঠা মিঠা লগা অনুভৱেতোমাৰে বতৰা আনে দেহে মনে আবিৰ সানেঅ' আউলি বাউলী মোৰ মন তোমাতেই মগনআমাৰ প্রেমৰ হʼব জানা শুভ মধুলগনঅ' আউলি বাউলী মোৰ মন তোমাতেই মগনআমাৰ প্রেমৰ হʼব জানা শুভ মধুলগনজনম জনমলে হৈ ৰম তোমাৰে বুকুৰে সাঁচি পাতত লিখি লোৱা প্ৰতিটো পলতে থাকিম মই কাষতে তুমিয়েই মোৰ কৃষ্ণচূড়া(৩) তোমাতেই বিচাৰি পাওঁ জীৱনৰ ভৰসাতুমি মোৰ জাগি উঠা আশাৰ সীমনা তোমাতেই সামৰি লওঁ প্ৰেমৰে পৰিভাষা তুমি মোৰ সপোনৰে জীয়া সাধনাঅ' আউলি বাউলী মোৰ মন তোমাতেই মগন আমাৰ প্রেমৰ হ'ব জানা শুভ মধুলগনঅ' আউলি বাউলী মোৰ মন তোমাতেই মগন আমাৰ প্রেমৰ হ'ব জানা শুভ মধুলগনজনম জনমলে হৈ ৰম তোমাৰে বুকুৰে সাঁচি পাতত লিখি লোৱা প্ৰতিটো পলতে থাকিম মই কাষতে তুমিয়েই মোৰ কৃষ্ণচূড়া"
"RzxdoO0_2gk","കോടികൾ വിലവരുന്ന Home Tour !! 🔥🔥","2023-08-25T13:51:18Z","UC9I8DWhqm5q7U_4fhfDwZIw","Arjyou","24","23.28.08","Arjyou|Arjyou reaction|Arjyoulive","582594","0","0","1241","https://i.ytimg.com/vi/RzxdoO0_2gk/default.jpg","False","True","Checkout second channel : https://www.youtube.com/ArjyouliveMy instagram : https://www.instagram.com/arjyou_/My Facebook page : https://www.facebook.com/arjunsundaresanofficial/Thumbnail by : JR Bharath  ( https://www.instagram.com/j.r_bharath )⚙️My Setup⚙️Camera : https://amzn.to/2KIZAQcHeadset : https://amzn.to/396yfj5 Keyboard: https://amzn.to/2LaFJsOMouse: https://amzn.to/2LdVJKtMicrophone : https://amzn.to/3pCYAM6Microphone Stand : https://amzn.to/3o6eRsGWebcam : https://amzn.to/2JyOHQ8Disclaimer : DISCLAIMER: Please don't go out of your way to or hate on anyone I talk about in my videos, this channel is to entertain people and I usually focus on joking about what the people are doing not the individual themselves, please don't go spreading hate it's all for laughsCopyright Disclaimer Under Section 107 of the Copyright Act 1976, allowance is made for fair use for purposes such as criticism, comment, news reporting, teaching, scholarship, and research. Fair use is a use permitted by copyright statute that might otherwise be infringing. Non-profit, educational or personal use tips the balance in favor of fair use.Thank you !"
"3jo23mIGdn8","దుబాయ్ బంగారం పంచుతున్న కొమ్రక్క మొగుడు || KOMARAKKA TV || VILLAGE COMEDY || DUBAI EPISODE -02 ||","2023-08-27T02:00:07Z","UCKWD18r-qvAYT2fJ3SvXOrQ","komarakka Tv","24","23.28.08","[none]","107314","0","0","247","https://i.ytimg.com/vi/3jo23mIGdn8/default.jpg","False","True","#KOMARAKKATV#DUBAIGLOD#VILLAGECOMEDY#https://youtu.be/3jo23mIGdn8https://youtu.be/57DTXGz3fyohttps://youtu.be/MYLUSKI9JIohttps://youtu.be/KnLjRAyIxVwhttps://youtu.be/YZzFda1oGUkhttps://youtu.be/Yab2FKQHHIohttps://youtu.be/FrhCScEaLukhttps://youtu.be/4bOwgFmyUxwhttps://youtu.be/rbpB_Bh3SBk#https://youtu.be/io7h8AFPzwhttps://youtu.be/VgIJQLgPsWUVIDEO EDITOR : K.SURESH       MOBLIE9 : 9000134632https://youtu.be/ZJswc0FlM3chttps://youtu.be/BulW5MY_c4ohttps://youtu.be/axb6lgB6hnYhttps://youtu.be/NwbRaxnKFyghttps://youtu.be/BXfpUy5oXXQhttps://youtu.be/AHKM5x4ZF9ohttps://youtu.be/XjzAOmL7-KYhttps://youtu.be/0BA71EVCXawhttps://youtu.be/QUmTwbOebh0 ప్రవీణ్ పెళ్లి || JABARDASTH PRAVEEN || KOMARAKKA TV || VILLAGE #KOMARAKKATV##balagamepisode#https://youtu.be/l1wusaInoM0https://youtu.be/CQj7-6Pe2DAhttps://youtu.be/xu0VHlfzabIhttps://youtu.be/Gjkiv8k6b8Qhttps://youtu.be/y-Q3_M0T5oIhttps://youtu.be/xWP80LKQJgchttps://youtu.be/cE3OahOuyU4https://youtu.be/Soxytg83xBohttps://youtu.be/ElPm-Dd0p-shttps://youtu.be/LZaDGkAPNIUhttps://youtu.be/tiF8FW3kxTohttps://youtu.be/_FNiRNgJQJEhttps://youtu.be/K7rJMNSk3jYplease subscribe for more updatesSubscribe : https://youtube.com/user/komarakk tv                                                                                            👉Facebook : https://facebook.com/komarakka.fans                                                                               👉Instagram : https://instagram.com/komarakka #KomarakkaTv#Jabardasthapraveen#VillageComedyCategoryEntertainment"
"wz5BIbhqhTI","Baby - O Rendu Prema Meghaalila Video | Anand Deverakonda, Vijai Bulganin","2023-08-24T12:16:50Z","UCTNtRdBAiZtHP9w7JinzfUg","SonyMusicSouthVEVO","10","23.28.08","Sony Music South|Sony Music|Latest Song|Telugu song|Telugu Latest Song|Telugu Latest Songs 2023|Latest songs in Telugu|Songs in Telugu|Latest Telugu Movies|Telugu Movie Songs|Latest Video Songs Telugu|latest Telugu Love Songs|Latest Telugu Hit Songs|Telugu Songs 2023|New Telugu Songs|Video Songs Telugu|Rendu Prema Meghaalila|Sony Music Entertainment India Pvt. Ltd.|Soundtrack (Telugu)|Vijai Bulganin Sreerama Chandra","790445","0","0","176","https://i.ytimg.com/vi/wz5BIbhqhTI/default.jpg","False","True","#BabyTheMovie is a new age love story starring Anand Deverakonda, Vaishnavi Chaitanya, Viraj Ashwin Directed by Sai Razesh.Music by Vijai Bulganin.The Film is produced under the banner of Mass Movie Makers by SKN.#Baby #AnandDeverakonda #VaishnaviChaitanya #VirajAshwin #SaiRazesh #vijaibulganin #MasaMovieMakersMusic Composer : Vijai BulganinLyricist: Anantha sriramSingers : Sreerama Chandra & Kids Chorus (Veda Vagdevi,Harshita,Tanishka,Ujjwal,Anagha & Veekshith)Female hummings: Lakshmi MeghanaKeyboard programmer : Bhuvanesh Narayanan DAdditional keyboard programmer: Balu.SStrings arrangements and programmed: Sreerag Dennies Live strings: chennai strings section Conductor: EnzonFlute : Lalit TalluriGuitars and ukulele: Abin Sagar Bass Guitar: I B Shallu VarunVocal arrangements and recorded by : Anudeep Dev Recording engineers: anand gurrana, K.K Senthil Prasath (Vanajkesav Digi Audio Waves) , bhanu prasad ( the sound dockk)Mixing Engineer: Balu.SMastered by : Rupendar Venkatesh@ Mix Magic StudiosMusic Label - Sony Music Entertainment India Pvt. Ltd.© 2023 Sony Music Entertainment India Pvt. Ltd.Subscribe Now: http://bit.ly/SonyMusicSouthVevoSubscribe Now: http://bit.ly/SonyMusicSouthYTFollow us: https://www.instagram.com/sonymusic_south/Follow us: Twitter: https://twitter.com/SonyMusicSouthLike us: Facebook: https://www.facebook.com/SonyMusicSouthhttp://vevo.ly/PuPI8j"
"rOeXMuyG6aA","King of Kotha | DQ | My Opinion | Malayalam","2023-08-24T12:04:43Z","UCNhaliLwhGH9wX3pe9bFTbA","LifeofShazzam","22","23.28.08","[none]","1160960","0","0","3653","https://i.ytimg.com/vi/rOeXMuyG6aA/default.jpg","False","True","രജിസ്റ്റർ ചെയ്യൂ: https://forms.gle/BMBiAXkeSqhk7odw7കോഴ്സിനെ കുറിച്ച് കൂടുതൽ അറിയാനും സ്പെഷ്യൽ ഓഫർ നേടാനും. കോൾ ചെയ്യൂ: +91 7012110207"
"sp93OIYbk3M","Ghum Hai Kisikey Pyaar Meiin Promo |27th August 2023","2023-08-27T05:22:18Z","UCyETxeA3DlwsK5Eu3lo_XIA","India Forums Hindi","24","23.28.08","[none]","588004","0","0","14","https://i.ytimg.com/vi/sp93OIYbk3M/default.jpg","False","True","Ghum Hai Kisikey Pyaar Meiin Promo |27th August 2023"
"VMfhA4qrvvw","What if Earth Stopped Rotating Suddenly in Telugu | Best Space Videos In Telugu Badi","2023-08-27T04:22:41Z","UCE750MuIvjaYeD5aGUjJcCQ","Telugu badi (తెలుగుబడి)","28","23.28.08","telugu badi|What if|what if earth stops rotating|Earth stop Spinning|telugubadi|space videos in telugu|earth|what if scenario|science video|why earth spins|earth's magnetic field|Learn language|Learn New Language|Best app to learn new language|learning videos|earth rotation|circadian rhythm|earth core|stop spinning|what happens if|Best science videos in telugu|what if earth|The Earth Stopped Spinning|space facts|earth facts|What if scenarios","111960","0","0","500","https://i.ytimg.com/vi/VMfhA4qrvvw/default.jpg","False","True","Download Duolingo For Free and Learn English From Telugu Language - https://app.adjust.net.in/13my1w4yWhat if Earth stopped spinning suddenly in TeluguFollow Us on:⯈Website:      www.telugubadi.in⯈Instagram:  https://www.instagram.com/telugubadiofficial/⯈Telegram:    https://t.me/telugubadi⯈YouTube:     https://goo.gl/vCPwXG⯈Facebook:   https://goo.gl/bUpT1m⯈Twitter:        https://twitter.com/AskTeluguBadi==============Music Credits:Time Passing By by Audionautix is licensed under a Creative Commons Attribution license (https://creativecommons.org/licenses/by/4.0/)Artist: http://audionautix.com/-------For Any Copyrighted Matters Contact us: telugubadiofficial@gmail.comDisclaimer- Some contents are used for educational purpose under fair use. Copyright Disclaimer Under Section 107 of the Copyright Act 1976, allowance is made for fair use for purposes such as criticism, comment, news reporting, teaching, scholarship, and research. Fair use is a use permitted by copyright statute that might otherwise be infringing. Non-profit, educational or personal use tips the balance in favor of fair use.--------#Earth #Whatif #TeluguBadi"
"xvMDFQIMDeA","Kadhal 2 Kailasa Episode - 6 | Love Series | K2K | Micset","2023-08-24T14:00:12Z","UC5EQWvy59VeHPJz8mDALPxg","Mic Set","23","23.28.08","micset|mic set|micset sothanaigal|sothanaigal|mic set sothanaigal|sothanaigal micset|mic set comedy|mike set|micset sriram|micset new episodes|mic set videos|micset sothanaigal in tamil|#micset|micset videos|mic set in tamil|micset latest episode|micset in tamil|web series|love series|comedy series|trending|episode 4|leo|love failure series|maaveeran|trending web series|micset web series|sothanaigal series|sriram web series|sriram video|sriram","697692","0","0","1765","https://i.ytimg.com/vi/xvMDFQIMDeA/default.jpg","False","True","Download Duolingo for Free - https://app.adjust.net.in/13jlpfi4Hey Guys! Want to know what happened in the life of a Love Failure Boy?! Watch our next K2K Episode 6 to know more.#micset #webseries #k2k #kadhaltokailasa  #ad Cast & crew:Sriram ( INSTA ID https://www.instagram.com/sriram_prince_)Luthufunnissa ( INSTA ID https://instagram.com/luthuf_official...)Chuttiaravind ( INSTA ID https://instagram.com/chuttiaravind?i...)Nivedha (INSTA ID https://instagram.com/rjnivedha?igshi...)Direction :Bush( INSTA ID https://instagram.com/bush_dir?igshid...)Cinematographer :Charls( INSTA ID https://instagram.com/charlz_dp?igshi... )Music theme :Arulraj ( INSTA ID https://instagram.com/aj_music_produc...)Editor :Kaiyon Ilaya ( INSTA ID https://instagram.com/kaiyon_ilaya?ig...)Music mix:Sriram ( INSTA ID https://www.instagram.com/sriram_prince_)Exe producer :Chandru ( INSTA ID https://instagram.com/chandru_kidboy?...)Manager :Abinash (INSTA ID https://instagram.com/abinash_rajtha?...)Dinesh ( INSTA ID https://instagram.com/dhinesh.dany?ig...)Business Developer :Raji (INSTA ID https://instagram.com/rajii_ganesh?ig...)__________________________________For Promotions, Branding, Digital Marketing Contact : +91 8248991430Email: officialmicset@gmail.com_______________________________________Sriram ( INSTA ID - https://www.instagram.com/sriram_prince_ )___________________________________________Facebook page : https://www.facebook.com/micsetchannel/instagram          :  https://instagram.com/micset_micset/twitter                 :  https://twitter.com/micset_official/___________________________________________In Association with DIVO - Digital Partnerhttp://www.Facebook.com/divomovieshttps://Twitter.com/divomovieshttps://Instagram.com/divomovies"
"k95h4TBRg_U","बिहार शिक्षक भर्ती Expected Cut off & Safe Score By IAS Ranjit Sir | bpsc teacher cut off 2023","2023-08-27T14:12:39Z","UCrCnLuVWHEvG4XHsT8QiNMw","Dr. Ranjit Kumar Singh, IAS","27","23.28.08","bihar 7th phase history|bihar 7th phase gk gs|Bihar Shikshak Bharti|BPSC Teacher|BPSC शिक्षक बहाली|bihar teacher vacancy 2023|bpsc teacher online classes|bihar teacher free class|bihar teacher live class|Bihar 7th Phase|बिहार शिक्षक भर्ती|7th phase exam date 2023|bihar teacher gs question|ias ranjit sir|ranjit sir ias|IAS Ranjit Singh|BPSC|bpsc teacher vacancy 2023|bpsc teacher vacancy|bihar job|bihar govt job|bihar govt jobs|bpsc teacher bahali|bpsc","166585","0","0","548","https://i.ytimg.com/vi/k95h4TBRg_U/default.jpg","False","True","बिहार शिक्षक भर्ती Expected Cut off & Safe Score | Bihar Teacher Exam Strategy | BPSC Teacher Exam | बिहार शिक्षक भर्ती 2023 पास करने का तरीका | Bihar Teacher Exam Strategy | Bihar Teacher Guess Set |बिहार शिक्षक भर्ती 2023 | How To Reduce Negative Marks in Exam | Bihar Teacher Tips & Tricks | बिहार शिक्षक भर्ती 2023 | Bihar 7th Phase Teacher Vacancy | Bihar Teacher Breaking News | BPSC | बिहार शिक्षक भर्ती 2023 BREAKING NEWS | शिक्षक भर्ती नियमावली | Bihar 7th Phase Teacher Vacancy by IAS Ranjit Sir▬▬▬▬▬▬▬▬▬▬▬▬In today's class, we have discussed BPSC शिक्षक बहाली | BPSC Teacher Live Class | बिहार SUPERTET 2023 | Teacher Vacancy in Bihar | bpsc, Bihar 7th Phase 2023 | BIHAR SPECIAL + GK & CURRENT AFFAIRS | part-01 | बिहार शिक्षक भर्ती, BIHAR TEACHER 7th PHASE LATEST NEWS | BIHAR TEACHER VACANCY 2023 | BIHAR 7th PHASE Exam Date 2023 | Bihar Teacher News | Bihar Teacher Niyojan Latest News | Bihar Teacher Vacancy 2023 Latest News | Bihar Teacher Salary | Bihar Teacher Eligibility Criteria 2023 | Bihar Teacher Bahali | Bihar 7th Phase Syllabus Out 2023 | bpsc teacher eligibility criteria | bpsc teacher syllabus out | BPSC Teacher Syllabus In Hindi | Bihar Teacher 7th Phase Latest News | BPSC Teacher Syllabus In Hindi 2023 | Bihar Teacher BPSC Syllabus 2023 | Bihar Teacher Syllabus जारी | BPSC Teacher Syllabus In Hindi | BPSC Teacher Vacancy Books | BPSC Teacher Syllabus in Hindi | Bihar 7th Phase Syllabus Latest News | Bihar Teacher Vacancy | Bihar 7th Phase 2023 | बिहार शिक्षक भर्ती | Exam Pattern & Syllabus Out!! | BPSC Teacher Syllabus in Hindi, IAS Ranjit Singh से जानिए पूरी बात, गलती नहीं होगी | Bihar Teacher 7th Phase: नई नियमावली का विरोध...TET शिक्षक संघ ने कहा - विश्वासघात हुआ▬▬▬▬▬▬▬▬▬▬▬▬▬▬▬✦ Follow me on other social media👇 :-☞Twitter : https://twitter.com/RanjitIAS☞Instagram : https://instagram.com/iasranjit☞Facebook Page : https://www.facebook.com/IASRanjit☞Facebook Myself : https://www.facebook.com/RanjitIAS☞Mission 50 IAS Page : https://www.facebook.com/Mission50IAS/▬▬▬▬▬▬▬▬▬▬▬▬▬▬▬✦ Join OUR Telegram CHANNELS👇 :-☞Telegram : https://t.me/ranjitias▬▬▬▬▬▬▬▬▬▬▬▬▬▬▬ 🌎Visit Our Website:- http://www.mission50ias.in👨🏻‍🎓 Student Support:-🤙For any Help Call Now👇📲 8538917713 I 8825319955▬▬▬▬▬▬▬▬▬▬▬▬▬▬▬#biharshikshakbharti2023 #biharteachervacancy #IASRanjit #RanjitSinghIAS #IASRanjitSir #BPSC  #BiharTeacher7thPhase #BiharTeacher #BiharTeacherNews #biharexams #biharstet #teachingexams #biharsupertet #biharsupertet2023 #bihar7thphase #bihar7thphaseteachervacancy #biharbpsc #biharshikshak #biharteacher #biharexams #bihartet #biharshikshakbharti2023 #biharteachervacancy #iasranjitsir #bihar7thphase #biharteacherbharti #biharteacherbharti2023 #bihar7thphaseniyojan #biharteacherbhartisyllabus #biharteachersyllabus #bihar7thphaseevs #BiharTeacher7thPhase #BiharTeacher #BiharTeacherNews #todaycurrentaffairs #currentaffairs #currentaffairsinhindi #dailycurrentaffairs  #biharexams #biharstet #teachingexams #biharsupertet #biharsupertet2023 #bihar7thphaseteachervacancy #bihargk #biharspecialgk #biharbpsc #bihar #biharshikshak #biharhistory #generalstudies #bpscteacherscience #bpscteacherhindi #bpscteacherenglish #bpscteachermaths #bpscteacherreasoning #bpscteacherevs #bpscteachergeography #bpscteacherhistory #bpscteachergs #bpscteachergeneralscience #bpscteachergk #bpscteachercurrentaffairs"
"RjDhvrQswIo","Chandrayaan 3 - what will INDIA do on the MOON? | Abhi and Niyu explain Chandrayaan 3","2023-08-25T13:00:11Z","UCsDTy8jvHcwMvSZf_JGi-FA","Abhi and Niyu","27","23.28.08","abhi and niyu|abhi and niyu latest|abhi and niyu exposed|india today|latest news|infotainment|chandrayaan 3|chandrayaan 3 isro|isro live|chandrayaan 3 landing|chandrayaan 3 rover|pragyaan rover|vikram lander|moon landing live|moon landing animation|chandrayaan animation|ISRO animation|indian space programme|ISRO vs NASA|chandrayaan 3 live|trending","1744154","0","0","18282","https://i.ytimg.com/vi/RjDhvrQswIo/default.jpg","False","True","In this video Abhi and Niyu explain the different payloads of Chandrayaan 3 and what they will do on the moon. India made history by soft landing on the south pole of the Moon with Chandrayaan 3. India's moon mission consists of the Propulsion module, Vikram Lander, and Pragyaan rover which have 7 payloads and each of them are focusing on A video by Abhiraj Rajadhyaksha & Niyati Mavinkurve#chandrayaan3 #ISRO #abhiandniyuGet our equipment:My favourite camera: https://amzn.to/3hYR3ZTBudget camera to shoot videos: https://amzn.to/3vmcHtZBest Tripod to shoot videos: https://amzn.to/3VtVY2DBest Mic for YouTube: https://amzn.to/3C9OOtHBest light for background lighting: https://amzn.to/3WM1CyNPhone to shoot Reels: https://amzn.to/3GrhAZpBest laptop to edit on: https://amzn.to/3juJIS5Cheapest laptop to edit 4K videos: https://amzn.to/3vkSOUmFacebook: https://www.facebook.com/abhiandniyuInstagram: https://www.instagram.com/abhiandniyuTwitter: https://twitter.com/abhiandniyuAbout Us:Abhi and Niyu is the fastest growing Indian educational YouTube channel. Abhi and Niyu are a husband-wife couple who believe in the power of our youth.Abhi and Niyu started their page to talk about positive, impactful ideas and to inspire offline action from online content. It was a way to change the way our negative feeds operated and replace negative news with positive, action-oriented news that made some change. They decode and simplify issues for Millenials and believe small steps lead to big outcomes in the future. Their videos span different genres like history, environment, and sustainability, policy discussions, social commentary, economics, personal finance, among others."
"oq9hgXlsSMk","Amma Surprise ichndhi || Amma tho first video || Amrutha Pranay","2023-08-25T12:39:28Z","UC8cO1I1aaQ9oZIJJyDBFuKQ","Amrutha Pranay","22","23.28.08","Amrutha Pranay|Amrutha Pranay mom|Amrutha Pranay vlogs|Amrutha Pranay latest|Amrutha Pranay YouTube channel","626632","0","0","730","https://i.ytimg.com/vi/oq9hgXlsSMk/default.jpg","False","True",""
