video_id,title,publishedAt,channelId,channelTitle,categoryId,trending_date,tags,view_count,likes,dislikes,comment_count,thumbnail_link,comments_disabled,ratings_disabled,description
"v2UkoL1JKak","Ethirneechal - Promo | 27 August 2023 | Sun TV Serial | Tamil Serial","2023-08-27T08:10:37Z","UCBnxEdpoZwstJqC1yZpOjRA","Sun TV","24","23.28.08","Ethirneechal|Ethirneechal serial|Ethirneechal promo|Ethirneechal today|Ethirneechal serial today|Ethirneechal sun tv serial|Sun TV Serial|Sun TV Serials|sun tv tamil serial|SunTV Serial Today|sun tv serial today|Sun tv full episodes|Sun tv tamil full episodes|Sun tv tamil shows|sun tv shows|Tamil Serials|tamil serials sun tv|Tamil Serial episodes","1520164","0","0","761","https://i.ytimg.com/vi/v2UkoL1JKak/default.jpg","False","True","Watch the Latest Promo of popular Tamil Serial #Ethirneechal that airs on Sun TV.Watch all your favourite serials exclusively ONLY on Sun NXT for FREE. *Free only for Indian Users.Download here:Android - http://bit.ly/SunNxtAdroidiOS: India - http://bit.ly/sunNXTWatch on the web - https://www.sunnxt.com/Urged by her father, Janani is always a high achiever. But her marriage into a patriarchal family dashes her dream of a career. Thus begins Janani's arduous journey towards empowering her family's oppressed women to unleash their power.#EthirneechalPromo #EthirneechalSerial #Ethirneechal #SunTVSerial #SunTVDon't forget to SUBSCRIBE to the Sun TV YouTube 👉 http://bit.ly/suntvsubscribe---------------------------------------------------------Watch more:Movie Clips on SUN NXT - https://bit.ly/3gc1dPIShows from Sun Music - http://bit.ly/2YS5eBiComedy Shows from AdithyaTV - http://bit.ly/2K6VaiZNews from Sun News - http://bit.ly/2Yyvgsi---------------------------------------------------------SUN NXT: Watch the latest movies in DOLBY DIGITAL PLUS, 4000+ Movies in HD, 30+ Live TV Channels, TV Shows, TV Serials & Digital Exclusives on SUN NXT anywhere anytime.---------------------------------------------------------Follow us on Social Media for Latest Updates:Facebook: https://www.facebook.com/SunTVTwitter: https://twitter.com/SunTVInstagram: https://www.instagram.com/suntv---------------------------------------------------------#SuntvSerial #TamilSerialPromo #SunTVshows #NewTamilSerials #SunTV #SunTVserials #SunTVProgram #SunNXT #LatestTamilSerials #SuntvSerialPromo #SuntvSerialEpisodes #SunTVpromos #TamilSerialPromos #TamilTVserials #TamilSerialEpisodes---------------------------------------------------------"
"Fw9rh5rjt_E","BEBIKA tried to Roast ABHISHEK again😂","2023-08-27T08:50:00Z","UCHDQOZjxuSm0-LgLQtMeCqw","Dimple Malhan Vlogs","22","23.28.08","Dimple malhan vlogs|Family vlogs|Triggered insaan|Wanderer’s hub|Wanderer’s live|Fukra insaan|Fukra insaan live|Bigg boss ott2|Live insaan|Nischay malhan shorts","2695977","0","0","8328","https://i.ytimg.com/vi/Fw9rh5rjt_E/default.jpg","False","True",""
"TLrnEiwewM4","SONEYA | RAHUL VAIDYA , JIYA SHANKAR | ANIKET SHUKLA","2023-08-25T06:30:09Z","UCtnSX50ivnPgp5VmaREYXYw","RAHUL VAIDYA RKV","10","23.28.08","rahul vaidya new song|jiya shankar|jiya shankar big boss|new indi sing|new song|new love song|new love songs|romantic songs|indian romantic songs|new indian love song|trending songs|indian trending songs|pop songs|indian pop songs|new trending indian songs|indie songs|new indie song","1940906","0","0","16769","https://i.ytimg.com/vi/TLrnEiwewM4/default.jpg","False","True","This season, we invite you to fall in love with SONEYA. The indie love song of the year ❤️Singer: Rahul VaidyaComposer & Lyrics: Aniket ShuklaStarring: Jiya ShankarMusic Arrangement and Production: Aniket Shukla & Vaibhav Pani Guitars: Vaibhav Pani Mix & Master: Ashwin KulkarniRahul's Vocal recorded by : Rupak ThakurVideo CreditsVideo by: Oliver Maitland  (SHŌ Film and Media)DOP: Rico Surya Assistant Director: Karina Sokowati Photographer & Camera Assistant: Putnama Yuana Video Editor: Jay ParikhColorist: Rohit SinghPoster & Creatives: Goofi Graphics"
"4e79GcfIeuo","Bigg Boss Tamil.. Season 7.. 😎 | Launch Promo | Coming soon","2023-08-25T13:37:00Z","UC8lPjTzRiG37n1Q2kpz3Rfg","Disney+ Hotstar Tamil","1","23.28.08","[none]","290234","0","0","358","https://i.ytimg.com/vi/4e79GcfIeuo/default.jpg","False","True","சும்மாவே வீடு ரெண்டாகும்.. இப்ப வீடே ரெண்டாயிடுச்சு.. 🏠🏠 இன்னும் என்னென்ன ஆகுமோ.. 😀😎 | Bigg Boss Tamil Season 7 - விரைவில்.. #KamalHaasan #BiggBossTamil7 #BBT #BBTamilSeason7 #பிக்பாஸ் #VijayTelevision #VijayTV"
"AI7lClzdO04","Super Car Leke Elvish Bhai K Paas Pohoch Gaye 😍","2023-08-24T02:30:05Z","UCjvgGbPPn-FgYeguc5nxG4A","Sourav Joshi Vlogs","22","23.28.08","sourav joshi|sourav joshi vlogs|travel vlogs|family vlogs|toys|piyush joshi|piyush joshi vlogs|ICE BATH CHALLENGE|ICE BATH|SOURAV JOSHI ARTS|VLOG|VLOGS|DAILY VLOGS|DAILY VLOGGER|funny vlogs|piyush joshi gaming|SUPER CAR|SUPER CAR DELIVERY|SUPER CAR Ki Delivery|SUPER CAR VLOG|SOURAV JOSHI NEW CAR|SOURAV JOSHI NEW SUPER CAR|elvish yadav","6313610","0","0","13011","https://i.ytimg.com/vi/AI7lClzdO04/default.jpg","False","True","Follow me on Instagram- https://www.instagram.com/souravjoshivlogs/?hl=en I hope you enjoyed this videohit likes.And do subscribe to my channelThank you so much for watchinggod bless you all.lots of  ❤️( For Collaboration - officialsouravjoshivlogs@gmail.com"
"ChAkREkAkXw","Andari Bandhuvaya || EP-04 || Prasad Behara || Chill Stories || Tamada Media","2023-08-26T05:48:05Z","UC0K7NlrBvgVPgWLarkdf4cQ","Chill Stories","23","23.28.08","Andari Bandhuvaya|Maa Vidaakulu|Maa Vidaakulu Web Series latest Episode|Maa Vidaakulu Web Series Last Episode|chill stories|Maa vidakulu|Maa vidakulu New webseries|family bandi|Chill Stories|Tamada Media|Maa vidaakulu Telugu Web Series|maavidakulu|Mr macha|mr macha prasad behaera|Telugu comedy videos|Mr macha videos|family entertainment|Prasad behara|prasad behara videos|Maa Vidaakulu Season 02|Karthik annam|Mavidakulu Prasad|Swathi Bheemireddy","568407","0","0","524","https://i.ytimg.com/vi/ChAkREkAkXw/default.jpg","False","True","Download Duolingo for Free - https://app.adjust.net.in/13t9mitlFollow me here:https://www.instagram.com/chillstories_Cast Prasad beharaSwathi Bheemireddy ManiFm babai (trinadh)Jayitri Cheguri Aditya RamDopsrinivasRaghuEditor & SFXJayachandDiSekhar PulluriPublicity designerDhananjayTitle animation Aman#Chillstories #AndariBandhuvaya #Prasadbehara #Tamadamedia"
"TZ45s8BT-_0","Project Presentation Sothanaigal | College Days","2023-08-25T11:30:10Z","UCD1CuflSWxeAGVOwicubsWw","Sothanaigal","23","23.28.08","project presentation sothanaigal|project presentation|college video|college comedy|school comedy|tamil comedy|tamil trending|sothanaigal latest video|sothanaigal new video|college sothanaigal|scool sothanaigal|online class sothanaigal|college fun|students sothanaigal|project sothanaigal|sothanaigal youtube channel|tamil funny video|tamil funny video shortsamil sketch comedy|college love sothanigal|sothanaigal latest episode|sothanaigal channel|funny","661680","0","0","415","https://i.ytimg.com/vi/TZ45s8BT-_0/default.jpg","False","True","Download Duolingo for Free - https://app.adjust.net.in/m1zj2za#projectpresentation #sothanaigal #college Watch and enjoy the video till the end...SUBSCRIBE us for continuous entertainment.Cast:Marvin - https://www.instagram.com/vasanth_marvin/Praveen - https://www.instagram.com/praveenboxing95/Vasanth - https://www.instagram.com/vasanth_parthi/Gokul -  https://www.instagram.com/gokul_rocks/Sathish - https://www.instagram.com/sathish_sam26/Pavithra - https://www.instagram.com/steaffipavi/Merline - https://www.instagram.com/merline_josi/Vicky Mac -https://www.instagram.com/vicky__mac/Sairam - https://www.instagram.com/sairam_samp_/______________________________Camera:Vetri - https://www.instagram.com/vetri_d.o.p/______________________________Editing-Vfx- Sound designKrishna - https://www.instagram.com/krish_kisho/______________________________Script & Direction : Marvin - https://www.instagram.com/vasanth_marvin/_______________________________Facebook: https://www.facebook.com/sothanaigalboysInstagram: https://www.instagram.com/sothanaigal_/Twitter: https://twitter.com/sothanaigal?lang=en_____________________________In Association with DIVO - Digital Partnerhttps://www.facebook.com/divomovieshttps://twitter.com/divomovieshttps://www.instagram.com/divomovies/"
"q4rJbIz9doA","CHEAT DAY STRUGGLES | SUNDAY| ASIM RIAZ |Vlogs#2","2023-08-27T06:30:27Z","UC1h0qXQ954HIIBOe34AMg2g","Asim Riaz","24","23.28.08","Asim riaz new vlog|latest vlog India|new blog|mountain|travel experience new vlogs|cheat day Sunday vlog|asim vlogs|elvish Yadav new video|elvish Yadav new vlog|Elvis Yadav vlogs|ASIM RIAZ latest video|bigboss","216385","0","0","4651","https://i.ytimg.com/vi/q4rJbIz9doA/default.jpg","False","True",""
"6hLAZF6VcXk","Panchadara Bomma Web Series | Episode - 3 | Pravallika Damerla | Charan Lakkaraju | Infinitum Media","2023-08-26T14:04:28Z","UCeuS0PrJ5pAMWma1188ZnjQ","Pravallika Damerla ","24","23.28.08","panchadara bomma episode 3|panchadara bomma Web Series|panchadara bomma|pravallika damerla charan lakkaraju|Pravallika Damerla|charan lakkaraju|pravallika damerla short films|charan lakkaraju short films|latest telugu short films|telugu web series|telugu short films|telugu love short films new|romantic short film|short films telugu 2023|telugu short films 2023 latest|infinitum media|pravallika damerla latest short film|latest telugu short films 2023","85181","0","0","55","https://i.ytimg.com/vi/6hLAZF6VcXk/default.jpg","False","True","Register on Paytm Money : https://paytmmoney.onelink.me/9L59/m8ad4w06Panchadara Bomma is a Telugu Romcom Web Series Featuring Pravallika Damerla & Charan Lakkaraju as leads.Cast: Pravallika Damerla, Charan Lakkaraju, Ramesh, Harshini Balla, Dinesh Paruchuri, Rajesh LakkisettyProduced by  Vandana BandaruWritten & Directed By Hema SaiCo-Director: Vamsi PrabhasDOP: Saif ChayachitrakarEditor: Srikanth MacherlaMotion Graphics: Rishi BarigelaPoster Designer: Nikhil ChotuSound Engineer: Venkat, Bhaskar.Line Producer: Shiva GeddamExecutive Producer: Chandu JC#PanchadaraBomma #PravallikaDamerla  #CharanLakkaraju #InfinitumMedia Presented by #Infinitum Network Solutions. Disclaimer: We do not intend to promote investment/gambling of any kind.  Viewer discretion is advised. If your current residence is from Andhra, Assam, Odisha, Telangana, Nagaland, and Sikkim, you are advised to not participate."
"ehyG8AkdHMI","Karthigai Deepam (கார்த்திகை தீபம்) - Mon-Sat, 9:00PM - 27 Aug 23 - Promo - Zee Tamil","2023-08-27T06:30:12Z","UC_wIGmvdyAQLtl-U2nHV9rg","Zee Tamil","24","23.28.08","Zee Tamil|zeetamil|ஜீ தமிழ்|zee தமிழ்|zee tamil show|entertainment|Karthigai Deepam|Karthigai Deepam serial|Karthigai Deepam serial promo|Karthigai Deepam promo today|serial|zee tamil serial|Karthigai Deepam zee tamil serial|Karthigai Deepam tamil serial today|கார்த்திகை தீபம்|Kanmani|Rajashree|Arun|Muthazhagi|Amudha|Annalakshmi|Senthil|zee tamil promo tamil","825751","0","0","168","https://i.ytimg.com/vi/ehyG8AkdHMI/default.jpg","False","True","Click Here To Watch Full Episodes - https://zee5.onelink.me/RlQq/80c354afZee5 Paid Subscription Link: https://bit.ly/32gxIJ4Free Subscription click here: https://bit.ly/SubscribeFreeZeeTamilGet notified about our Latest update by Clicking the Bell Icon 🔔Karthigai Deepam (கார்த்திகை தீபம்) - Mon-Sat, 9:00PM - 27 Aug 23 - Promo - Zee Tamil#KarthigaiDeepam #KarthikRaj #Arthika #Deepa #Promo #ZeeTamilKarthigai Deepam - Deepa, a talented singer, faces discrimination as she's dusky. But meeting Karthikeyan, a successful businessman, changes her life drastically. Will Deepa be able to stand tall against societal norms?To Free Download ZEE5 Mobile app click the link belowPlaystore: http://bit.ly/Zee5PlayStoreiTunes: http://bit.ly/Zee5ITunesConnect with Zee Tamil on Social MediaFacebook: http://bit.ly/ZeeTamilFBInstagram: http://bit.ly/ZeeTamilInstaTwitter: http://bit.ly/ZeeTamilTwitterConnect with Zee5 on Social MediaFacebook: http://bit.ly/Zee5TamilFBInstagram: http://bit.ly/Zee5TamilInstaTwitter: http://bit.ly/Zee5TamilTwitter #ZeeTamil"
"a1mnttvOGTA","மனசு மாறிய  அனு  | Sundari - Semma Scenes | 25 August 2023  | Sun TV | Tamil Serial","2023-08-26T13:13:18Z","UCBnxEdpoZwstJqC1yZpOjRA","Sun TV","24","23.28.08","Sundari|Sundari serial|Sundari Semma Scene|Sundari serial Semma Scene|Sundari today|Sundari sun tv serial|Sun TV Serial|Sun TV Serials|sun tv tamil serial|SunTV Serial Today|sun tv serial today|Sun tv full episodes|Sun tv tamil full episodes|Sun tv tamil shows|sun tv shows|Tamil Serials|tamil serials sun tv|Tamil Serial episodes","1616627","0","0","129","https://i.ytimg.com/vi/a1mnttvOGTA/default.jpg","False","True","Watch the Semma Scenes of popular Tamil Serial #Sundari that airs on Sun TV.Watch all Sun TV serials immediately after the TV telecast on Sun NXT app. *Free for Indian Users onlyDownload here:Android - http://bit.ly/SunNxtAdroidiOS: India - http://bit.ly/sunNXTWatch on the web - https://www.sunnxt.com/Circumstances force Karthik to marry an ambitious girl Sundari while in love with another. Later he ties the knot with Anu & leads a double life. Watch Sundari rise above the shackles of a loveless marriage to achieve her IAS dream.#SundariSemmaScenes #SundariSerial #Sundari #SunTVSerial #SunTVDon't forget to SUBSCRIBE to the Sun TV YouTube 👉 http://bit.ly/suntvsubscribe---------------------------------------------------------Watch more:Movie Clips on SUN NXT - https://bit.ly/3gc1dPIShows from Sun Music - http://bit.ly/2YS5eBiComedy Shows from AdithyaTV - http://bit.ly/2K6VaiZNews from Sun News - http://bit.ly/2Yyvgsi---------------------------------------------------------SUN NXT: Watch the latest movies in DOLBY DIGITAL PLUS, 4000+ Movies in HD, 30+ Live TV Channels, TV Shows, TV Serials & Digital Exclusives on SUN NXT anywhere anytime.---------------------------------------------------------Follow us on Social Media for Latest Updates:Facebook: https://www.facebook.com/SunTVTwitter: https://twitter.com/SunTVInstagram: https://www.instagram.com/suntv---------------------------------------------------------#SuntvSerial #TamilSerialSemma Scenes #SunTVshows #NewTamilSerials #SunTV #SunTVserials #SunTVProgram #SunNXT #LatestTamilSerials #SuntvSerialEpisodes #SunTVSemmaScenes #TamilTVserials #TamilSerialEpisodes---------------------------------------------------------"
"OPoqBIEvoj0","We Bought a Premier League Team! | OT 40","2023-08-26T13:59:52Z","UCRijo3ddMTht_IHyNSNXpNQ","Dude Perfect","17","23.28.08","dude perfect|dude perfect stereotypes|dude perfect water bottle flip|bottle flip|water bottle flip|dude perfect bottle flip|dude perfect basketball|dp|dude perfect world record|edition|nerf|trick shots|trick shot|family|ping pong|bowling|clean|family friendly|bubble wrap|soccer|football|spinner|spinners|fidget spinners|dude|burnley|fc|premiere|premier|league|man|city|manchester|uk|united kingdom|culture|clash|betcha|overtime|40|ot|guys|in|disguise|wheel|trafford","3057314","0","0","3200","https://i.ytimg.com/vi/OPoqBIEvoj0/default.jpg","False","True","UP THE CLARETS! Overtime in the UK with Burnley FC! Wheel, Betcha & a Brand New Segment! Special thanks to HEYDUDE for sponsoring our breaking news! Click HERE to shop the Dude Perfect collection!! ► https://www.heydude.com/collections/dude-perfect-collection We could not be more excited to join the Burnley FC family! UP THE CLARETS!!Get your Burnley gear here! ► https://shop.burnleyfc.com/dude-perfect-burnley-fc-c159► Thanks for subscribing! - http://bit.ly/SubDudePerfectThanks for watching #Overtime40NEXT LEVEL STUFF -------------------------------------------🎒 NEW Merch - http://bit.ly/DPStore📱 Text us - (469) 205-7005🔔 Hit the bell next to Subscribe so you don't miss a video!👨🏻‍💻 Watch our newest vids! - http://bit.ly/NewDPVids📕 Read our Book - 101 Tips, Tricks and Cool Stuff - https://bit.ly/NewDPBookFollow our Instagrams so we can be best friends -------------------------------------------🏆 http://Instagram.com/DudePerfect🧔🏻 http://Instagram.com/TylerNToney👱🏻‍♂️ http://Instagram.com/Cody_Jones_🙋🏻‍♂️ http://Instagram.com/CobyCotton👨‍🦰 http://Instagram.com/GarrettHilbert⛹🏻‍♂️ http://Instagram.com/CoryCotton-------------------------------------------Bonus points if you're still reading this! Comment: I'm joining Burnley fan club now!Click here to learn more about Dude Perfect:http://bit.ly/AboutDudePerfectAs always...Go Big and God Bless!- Your friends at Dude PerfectBusiness or Media, please contact us at: Dude@DudePerfect.com------------5 Best Friends and a Panda.If you like Sports + Comedy, come join the Dude Perfect team!Best known for trick shots, stereotypes, battles, bottle flips, ping pong shots and all-around competitive fun, Dude Perfect prides ourselves in making the absolute best family-friendly entertainment possible! Welcome to the crew! Pound it 👊🏻 Noggin 🙇🏻‍♂️ - Dude Perfect"
"zSuAXbFHz2A","ചേച്ചി ഇല്ലാത്ത ആദ്യത്തെ പിറന്നാൾ","2023-08-25T12:11:53Z","UC5G8PTHGtZeuqPMbH_5_kQQ","Subi Suresh Official","22","23.28.08","subi suresh official|subi suresh artist|subi suresh vlogs|actress subi suresh|malayalam artist|സുബി സുരേഷ്|subi suresh birthday","316583","0","0","245","https://i.ytimg.com/vi/zSuAXbFHz2A/default.jpg","False","True","ഇന്നലെ ചേച്ചിയുടെ പിറന്നാളായിരുന്നു. ഏതു ലോകത്തിലാണെങ്കിലും ചേച്ചിയുടെ സന്തോഷത്തിനായി ഞങ്ങൾ അത് ഇങ്ങനെ ആഘോഷിക്കാൻ തീരുമാനിച്ചു. ആരൊക്കെ എന്തൊക്കെ പറഞ്ഞാലും ആ സന്തോഷമാണല്ലോ നമുക്ക് വലുത് #subisuresh #birthday **** Follow us on ****Youtube : https://bit.ly/2SWmljQFacebook : https://bit.ly/3lPJRvxInstagram - https://bit.ly/2T2OZA8For Business Enquiries, Mail to : subisureshofficial@gmail.com"
"_2CmjDjTDPQ","सबसे बड़ा रसगुल्ला World's Biggest Rasgulla | Hindi Comedy | Pakau TV Channel","2023-08-26T07:30:07Z","UCNzvEv3XpFYnWEbD5Ero7mw","Pakau TV channel","24","23.28.08","talking|india|hindi|indian|delhi|story|comedy videos|tv|new|comedy|short film|show|crazy|Laugh|hilarious|pakau tv|comedy show|new episodes|pakau tv channel|humor|entertainment|laughter|comedian|joking|हिंदी|कॉमेडी|फनी वीडियो|family|jokes|परिवार|पारिवारिक|Rasgulla|sweets|mithai|shop|shopkeeper|funny news|news reporter|actor|raksha bandhan|august 2023|rakhi special|Chhena|sweet cheese balls|big ants|चींटी|chiti|eating|running|news parody|2023|news anchor|sponge","133944","0","0","219","https://i.ytimg.com/vi/_2CmjDjTDPQ/default.jpg","False","True","👉 Instagram https://www.instagram.com/pakautvchannel👍 Facebook https://www.facebook.com/pakautv👉 Twitter https://twitter.com/pakautvArtists  Karan & Sachin#comedy #hindi #pakautv #Biggest"
"1Y1WggsTShU","King of Kotha Review | KOK | Dulquer Salmaan | Abhilash Joshiy | Jakes Bejoy","2023-08-24T17:57:10Z","UCr8xb2866oogDXDSN5-2Mxw","Aswanth Kok","24","23.28.08","[none]","562617","0","0","5979","https://i.ytimg.com/vi/1Y1WggsTShU/default.jpg","False","True",""
"i8tAl9eJvpw","Bhai Behan Aur Raksha Bandhan || TEJASVI BACHANI","2023-08-27T03:56:51Z","UCu0VvQ2FsbTCOW8vE4CHgwg","Tejasvi Bachani","24","23.28.08","tejasvibachani|tejasvibachanivideos|comedyvideos|funnyvines|theshivam|shaitanrahul|sumitbhyan|shivamdikro|lokeshbhardwaj|payaljain|aashishbhardwaj|sociopool|sociopoolindia|comedy|funny|funnyvideos|rachitrojha|sibbugiri|bigboss|elvishyadav|fukrainsan|puravjha|aashishchanchlani|RAKHI|RAKSHABANDHAN|FESTIVAL|BHAIBEHAN|BHAI|COMEDY","81501","0","0","93","https://i.ytimg.com/vi/i8tAl9eJvpw/default.jpg","False","True","Hello guys  video Kaisi lagi jraur btana LOVE YOU ALLVideo end tak dekhna ..Mjaa end m hi h Please Subscribe My Channel To Watch My Videos  Toh Pyaar Banaye Rakho Or Full Support Kro Jaldi Milte hai nayi Video Ke Saath My Instagram Id :- https://instagram.com/tejasvi_bachani..Cast:- Tejasvi BachaniMILANSHIVAM SHARMAROHIT RAWATSHILPA VermaPRAVESH UNCLEJaaduRahulEdit by : tejasvi bachani, Shaitan Rahul, JaaduShoot By:- Shivam SharmaThumbnail:- Raj Sharma"
"QGg_IKTnu0g","||vishesha varthanam||വിശേഷ വർത്താനം ||Malayalam Comedy Video||sketch Video||","2023-08-25T12:45:02Z","UCKQ_PSYYYL_rjWnWZ4m2THg","Enthuvayith(എന്തുവായിത്)","22","23.28.08","[none]","304710","0","0","589","https://i.ytimg.com/vi/QGg_IKTnu0g/default.jpg","False","True","പ്രസവം കഴിഞ്ഞു കിടക്കുന്ന പെൺകുട്ടികളെ കാണാൻ കുറെ വിശേഷക്കാർ വരും അവരെ ഒന്ന് കാണാം 😂❤❤● LL Soft Brush & Comb Set: https://www.amazon.in/dp/B09B1TZ2ZD● LuvLap grooming kit -4 pc – Blue: https://www.amazon.in/dp/B09PF1PZ8W● LuvLap 7 in1 Grooming Set : https://www.amazon.in/dp/B0B94J9GKP/● LuvLap Grooming Set : https://www.amazon.in/dp/B09JZKRDXN/#babygrooming #baby #babycare #babyboy #babygroomingkit #babygroomingset #babygirl #babyessentials #groomingkit #babywearing #babybathtime #babycareproducts #babymommylife #babygroomingcare #viral #babysafety #stayathome#luvlap #momswithluvlap #parenting #baby #babygear #momlife #babyessentials #newborn #luvlapbaby #babyproducts #babiesofinstagram #parents #babyproduct #babymodel #ad #indianmombloggers #toddlers #newbornstore"
"-cgam4j3jo4","Pisinari Amma || Moms || Dharma Paddu 143","2023-08-26T07:34:05Z","UCTZb5WPOtI0G92JW4Vz9fIw","Dharma Paddu 143","24","23.28.08","pisinari amma|talli|moms|money amma|thalli|good father|bad school childrens|mom daughter|dharma paddu 143|paddu","76487","0","0","81","https://i.ytimg.com/vi/-cgam4j3jo4/default.jpg","False","True","#moms #amma #pisinariamma #thalli📱 🤳 9951559444🤳 మీరు ఎన్నో సమస్యలతో బాధ పడుతున్నట్లయితే ఈ గురువు గారికి ఒక్కసారి నమ్మకంతో కాల్ చేయండి ఈ గురువుగారు చెప్పింది చెప్పినట్లుగా జరిగింది. మీరు ఏమి చెప్పవద్దు అని గురువుగారు చెప్తారు 📱 🤳 9951559444🤳"
"p0StJ9qoj6A","Dil Hi Toh Hai (Season 2) Episode 7 | KundraRitwik’s shocking decision | Yogita Bihani, Karan","2023-08-27T05:30:24Z","UCw82_BrKru_CjqIuTzf04Kw","ALTT","24","23.28.08","ALTBalaji|webseries|web series online|new web series hindi|alt balaji upcoming web series|alt balaji new shows|latest hindi web series|hindi drama web series|alt balaji new web series|hindi web series|altt india|altt|latest show|latest webseries|hot web show|trending|youtubevideo|latest trending video|hot video|ullu video|Anupama|#trending|#instaviral|#funnyvideo","308324","0","0","99","https://i.ytimg.com/vi/p0StJ9qoj6A/default.jpg","False","True","In Dil Hi Toh Hai Season 2, six years after Ritwik & Palak’s separation, Ritwik’s younger brother Shivam returns from London for the first time to find that Mamta is terminally ill and his family is not together anymore. Meanwhile, Ritwik is living with his family but has lost faith in love. Palak is now a single mother with twin daughters. The only thing common is that the lead characters, Ritwik-Palak both hate each other. On Mamta’s instructions, Shivam sets out on a mission to bring Ritwik & Palak back together. Will their love win over their hate for each other? Will Shivam succeed? Catch the second season of Dil Hi Toh Hai starring Karan Kundrra & Yogita Bihani on ALTT.Cast: Yogita Bihani, Karan KundraDirectors: Jeetu AroraUse kijiye code ALTTMR7170  aur paaiye #ALTT subscription par 20% discount or Use code ALT12SM6189 and Get 26% DISCOUNT on ALTT 12 Months Subscription Pack https://altbalaji.onelink.me/DEAs/Subscribe Website - https://altt.co.in/ Facebook - https://www.facebook.com/altt.in Twitter - https://twitter.com/altt_in Instagram - https://www.instagram.com/altt.in/#trending #instagood #explorepage #viralvideo #instaviral #viralcontent #trendy #share #popular #instatrend #viralpost #video #videogames #funnyvideos #musicvideo #videos #instavideo #videooftheday #videography #videogame #videostar #viralvideosr #videolucu #funnyvideo #satisfyingvideos #videoedits #komikvideolar #makeupvideos #videoshoot #videoclip #videoedit #videoproduction #videogram #montevideo #viralvideo #makeupvideo #newvideo #slimevideo #videoviral #dagelanvideo #videogameaddict #videomaker #memevideo #hairvideo #vivavideo #memevideos #dancevideo #musicvideos #comedyvideos #videokeren"
