video_id,title,publishedAt,channelId,channelTitle,categoryId,trending_date,tags,view_count,likes,dislikes,comment_count,thumbnail_link,comments_disabled,ratings_disabled,description
"b3nufQMgQKw","EXPOSING BIGG-BOSS SECRETS !! ‘Exclusive QNA’","2023-08-27T07:37:11Z","UClfos9f7uDdoun8ZyE9jYFg","Fukra Insaan","24","23.28.08","fukra insaan|triggered insaan|wanderers hub|fukra insaan live|malhan family","4601285","0","0","35920","https://i.ytimg.com/vi/b3nufQMgQKw/default.jpg","False","True","Follow me on Instagram for updates ➞  https://instagram.com/fukra_insaan?igshid=jytojomgh8j4Join my discord server ➞https://discord.gg/Es7PVh4BAKMy second youtube channel ➞ https://youtube.com/channel/UCi5kSELjaJWmnBKPXkTcxsAMy twitter ➞ https://twitter.com/AbhishekMalhan4?s=09"
"rPadun7ANwo","We Made UFO Car | कीमत - ₹ 1000000000000000000000000000000000000000000000000000000000000000000000000","2023-08-27T09:19:39Z","UCSiDGb0MnHFGjs4E2WKvShw","MR. INDIAN HACKER","28","23.28.08","UFO CAR|UFO|CAR|UNIQUE|unique car|mr indian hacker|mr. indian hacker|new car|cars|how to|we made|made|build|project|science project","3000146","0","0","23519","https://i.ytimg.com/vi/rPadun7ANwo/default.jpg","False","True","My Team Build Unique Car For Mr. Indian Hacker....Fully ElectricWe Named This Car As Ufo Car Ab Description Dekh Hi Liya Hai To Follow Bhi Kar Lo -Instagram - https://instagram.com/Dilraj_Singh_RawatTwitter - https://twitter.com/MR_INDIANHACKER.This Is Our Coolest Science Project Ever.Love You All Guy's."
"hRepvOfGDfE","Asher ka CHOLA CEREMONY Vlog || Family Function","2023-08-26T09:10:53Z","UCtyltqstMm6iKnkk2Y9Zt8A","Wanderers Hub","22","23.28.08","wanderers hub|challenges|asher|asher chola ceremony|asher chola ceremony vlog|chola function|baby function|baby ceremony|baby vlog|triggered insaan|fukra insaan|family vlog|family video|india family vlog|hindi family vlog","4814152","0","0","11079","https://i.ytimg.com/vi/hRepvOfGDfE/default.jpg","False","True","Harsh's OUTFIT: https://www.instagram.com/zenith_nishant_kumar/Venue: @Crowne Plaza New Delhi RohiniEvents & Decor: @jaimalaplannerz Makeup :Simran : @blushoncheeks Videography: @vavpixels Hair: MansiSUBSCRIBE!!! . . Read my travel stories: https://www.wanderershub.com/ Facebook - https://www.facebook.com/WHtravel/ Twitter - https://twitter.com/HubWanderers Instagram - https://www.instagram.com/wanderershub/ Pinterest - https://in.pinterest.com/WandererHub/ ..About Me ► My name is Prerna Malhan. I'm from Delhi and I'm a WRITER. Now I am pursuing Youtube full-time. I make entertainment and travel videos on this channel. Thanks for reading."
"X54EvXaxpRw","Can ACP Solve This Mystery?","2023-08-27T08:30:08Z","UCx6F-rETGiz7xf_vkMmX2yQ","Mythpat","24","23.28.08","mythpat acp|acp mystery|acp solves case|mystery video|mythpat funny videos","2532578","0","0","23420","https://i.ytimg.com/vi/X54EvXaxpRw/default.jpg","False","True","Aaj ACP sir ke saath hum karenge Mystery Solve! Can ACP Sir Solve this case? Kuch to Gadbad haiThank you so much Shivaji Satam Sir. You are awesome!Thank youu @HiSaimanSays Thank youu @NeonMan Amazing Team - Director : PalibouyDOPs : Palibouy, Shashank Trivedi, HemanshColorist : Gurjyot Singh SangheraAD : Sarthak ChopraThumbnail design : Yogesh Naraniamy instagram - https://www.instagram.com/mythpatsongs used -OFF THE ROAD - Zarii @ZariiMusic (You are amazing)In this video we also play games with ACP sir after the Investigation and Surprise him. Hope you enjoy!Thanks for Watching!"
"rFnxNiiw1wI","Skanda Trailer (Telugu) | Ram Pothineni, Sree Leela | Boyapati Sreenu | Thaman S | SS Screens","2023-08-26T15:39:30Z","UCSXwEK86-OWEn_QF65X7c7Q","Junglee Music Telugu","24","23.28.08","Skanda|skanda trailer|skanda|skanda title launch|skanda title glimpse|skanda movie|boyapati|ram boyapati|boyapatirapo|boyapati rapo|boyapati srinu|#boyapatirapo|boyapati sreenu|boyapatirapo20|boyapati ram movie|ram boyapati movie|boyapati srinivas|boyapati rapo movie|boyapatirapo movie|boyapati rapo teaser|boyapatirapo update|boyapati rapo update|boyapatirapo trailer|#boyapatirapo teaser|boyapatirapo updates|boyapatirapo glimpse|thaman|sthaman","24154628","0","0","8169","https://i.ytimg.com/vi/rFnxNiiw1wI/default.jpg","False","True","Here's the Massive Thundering Trailer of Skanda starring Ustaad Ram Pothineni, Sree Leela & Others. Directed by Boyapati Sreenu. A Thaman S Musical.Skanda In Theatres from September 15th 2023 in Telugu, Tamil, Hindi, Kannada and Malayalam.#Skanda #SkandaTrailer #RamPothineni #BoyapatiSreenu #SreeLeela #SrinivasaaSilverScreen #SrinivasaaChitturi #PavanKumar #ZeeStudios #Tammiraju #StunSiva Like || Share || Spread || Love Make sure you subscribe and never miss a video: https://bit.ly/2RN00rZ Technical Crew :Writer, Director : Boyapati Sreenu Producer : Srinivasaa ChitturiBanner : Srinivasaa Silver ScreenPresents : Zee Studios, Pavan KumarMusic : Thaman SCinematographer : Santosh DetakeEditor : TammirajuAction : Stun SivaChoreography: Prem Rakshith MasterPRO : Vamsi Shekar, Pulagam ChinnarayanaMarketing : Vishnu Thej PuttaColorist : J. Venu Gopal Rao DI : Annapurna StudiosAudio On : Junglee MusicEnjoy and stay connected with us!!►Subscribe us on YouTube: ►Like us:  http://on.fb.me/1JM72Nf►Follow us: http://bit.ly/1jkVDxg►Circle us: http://bit.ly/1N5n48ySUBSCRIBE Junglee Music Channels for unlimited entertainment: ►For Kannada Songs & Videos : http://bit.ly/1WmC9H2►For Tamil Songs & Videos:  http://bit.ly/1Z2vfsO►For South Devotional Songs: http://bit.ly/1VD5kc0© 2023 Times Music"
"DLA_64yz8Ss","Chandrayaan-3 Mission Soft-landing LIVE Telecast","2023-08-23T13:03:39Z","UCw5hEVOTfz_AfzsNFWyNlNg","ISRO Official","28","23.28.08","[none]","77805569","0","0","113769","https://i.ytimg.com/vi/DLA_64yz8Ss/default.jpg","False","True","Chandrayaan-3 Mission Soft-landing LIVE Telecast"
"Od6XIK2IGGc","Reacting to ABHISHA cute moments😍","2023-08-26T08:55:26Z","UCi5kSELjaJWmnBKPXkTcxsA","FUKRA INSAAN LIVE","24","23.28.08","[none]","3812339","0","0","37077","https://i.ytimg.com/vi/Od6XIK2IGGc/default.jpg","False","True","Follow me on Instagram for updates ➞  https://instagram.com/fukra_insaan?igshid=jytojomgh8j4Join my discord server ➞https://discord.gg/Es7PVh4BAKMy twitter ➞ https://twitter.com/AbhishekMalhan4?s=09"
"BsLQx3tbhnI","FRUIT JELLY CAKE | Colorful Healthy Fruit Jelly Cake Recipe Making in Village | Agar Agar Jelly","2023-08-27T14:04:36Z","UCk3JZr7eS3pg5AGEvBdEvFg","Village Cooking Channel","26","23.28.08","jelly|fruit jelly cake|fruit cake|jelly making|fruit jelly|fruit recipes","2854844","0","0","2497","https://i.ytimg.com/vi/BsLQx3tbhnI/default.jpg","False","True","Today, in our village, we make colorful fruit jelly using marine algae. We use healthy fruits such as Kiwi, Muskmelon Fruit, Grapes, Green, Grapes, Pomegranate, Mango, Strawberry, Papaya, White Dragon Fruit, Red Dragon Fruit, and Watermelon.We cool the mixture overnight and get the colorful jelly cake the following day.Taste is Delicious!"
"tOhhYWGl36M","Save The Ice Challenge- RESULTS | किसकी बर्फ बचेगी और 10 लाख जीतेगा? Unexpected Results","2023-08-26T09:40:49Z","UCebC4x5l2-PQxg46Ucv9CsA","Crazy XYZ","28","23.28.08","save the ice challenge|crazy xyz ice challenge|craz xyz save the ice|save the ice|save ice|save ice challenge|crazy ice challenge|crazy xyz|the indian unboxer|tiu|save|ice|challenge|crazy xyz challenge|best challenge in india|rupees 10 lakh challenge|1000000 rupees challenge|winner will get rupees 10 lakh|best challenge|crazy challenge|result|part 2|ice challenge part 2|ice wali video|barf wali video|crazy|xyz","2807850","0","0","6676","https://i.ytimg.com/vi/tOhhYWGl36M/default.jpg","False","True","Hello guys, is video me humne Save the ice challenge ka result nikala hai.Our Unboxing Channel- https://www.youtube.com/channel/UCIcKN-VXhkZNpf5DRdHp9JAOur Shorts Channel- https://www.youtube.com/channel/UC7bZ8U3-WqDzHiyz6Hc6TmAFollow Me on Instagram- https://www.instagram.com/amit.yt/Follow Us On Facebook- https://www.facebook.com/CrazyXYZfb/"
"3Nge7cQMo3g","Apharan | अपहरण | Sukki Dc | We Are One","2023-08-26T12:30:04Z","UCw5N06QIrXBg92OfOVpvWkg","We Are One","23","23.28.08","[none]","621672","0","0","3036","https://i.ytimg.com/vi/3Nge7cQMo3g/default.jpg","False","True","Experience the excitement of trading on Binomo and earn up to 2 250 INR per day: https://binomoindia.in/We_Are_Ones_yt Use my promo code and get +50% bonus on your deposit: WEN100Read about VIP: https://binomo.com/en/promo/l34Read about Prestige: https://binomo.com/en/promo/l79Follow us on instagram: https://www.instagram.com/team_weareone/Shoot by : Mohit Bainsla , Krishan BhardwajEdited by : Mohit bainsla , Krishan BhardwajBackground music : Dc Script by : Team We Are OneThumbnail : Raj Sharma sukki dc new videosukki dc funnyvideosukki dc comedywe are one comedywe are one funnyManaged by: Sociopool India private limited https://www.sociopoolindia.com"
"xVfEu_I167s","🥮 రాఖీ ❤️|Rakhi festivals | Village Emotional & comedy | Laxmi srikanth videos#rakshabandhan","2023-08-27T04:30:20Z","UChpUSSTjbH8Ou8wz7wpkCTg","5 STAR","24","23.28.08","creative thinks|my village show|dhoondhaam Channel|telugu comedy|village videos|village vihaari|think deep|chinnu","226631","0","0","374","https://i.ytimg.com/vi/xVfEu_I167s/default.jpg","False","True","Download Duolingo, click ‘more’ and scroll to find Telugu among the many languages - https://app.adjust.net.in/1343asqzHii Friends this is my new short film|| రాఖీ పండగ || emotional  Video || plz watch like share and Subscribe for more updates..... 8639938599 : Advertisement Only Whatusp Our Village LocationVillage : Kondapur & AmbaripetMandal : VelgatoorDistrict : JagityalState : Telangana.........................................................................................................................#5Strachannel#LaxmiVideos#rakhipandaga#rakhi #emotional #sisterbrother #sentimental #rakhispecial #Maguva#5StarAtoZ#01trendingvideos #entertainmentvideos #02trendingvideos #5Starchannelvideos#01trendingvideos#Newlovestorys#Telugulovestroys#Entertainmentvideos#Comedyvideos#NewTrendingVideos#SrikanthVideos#5StarNewVideos#FullEmotionalvideo"
"w-mj2nxWlOI","విలేజ్ లో ఇసుక దందా పార్ట్ 3 | Tractor owners vs Sarpanch | My village show | Gangavva | Anilgeela |","2023-08-26T11:45:17Z","UCnprfRlJB7WE6zAEaOAfVYA","My Village Show","23","23.28.08","my village show|village|village life|village show comedy|gangavva|raju|gangavva comedy|gangavva jokes|anil geela|sarpanch|anji mama|daawath|village comedy|telugu short film|telangana comedy|telangana short films|mvs|mvs comedy","592130","0","0","589","https://i.ytimg.com/vi/w-mj2nxWlOI/default.jpg","False","True","Download Duolingo for Free - https://app.adjust.net.in/13jw0du0For Brand Partnerships and Collaborations, reach us at brands@myvillageshow.inIsuka Danda part-1 : https://youtu.be/L2E4JVhTb_IIsuka Danda part-2 : https://youtu.be/Dfl879MOTqUACTORS : Gangavva, Raju, Chandu , Anil geela ,Shiva krishna burra ,Srikanth ,Thirumal ,Madhu elkus ,Mallareddy ,Bodige Thirumal , Kotesh , Kanakam Venkat , Madhu Alwala , Pavan , Mallesham , Mohan ,Prashanth , Srinivasa charyWritten and Directed by : Shiva krishna BurraDOP : Thirumal Gorre Editing : Thirumal Gorre,  Anil Geela Excutive producer : Prashanth Sync sound : Pavan , Madhu elkus Thumbnail: vinay machaProduced by Sriram Srikanth follow us on social media :my village show Facebook page : https://www.facebook.com/myvillageshow/my village show instagram : https://www.instagram.com/myvillageshow/my village show twitter : https://twitter.com/myvillageshowwebsite : www.myvillageshow.in"
"K4Zm67P9Z6Y","101 మందితో మా ఇంటి వరలక్ష్మి వ్రతం || @SidshnuOfficial || Tamada Media","2023-08-26T13:20:12Z","UCnC7imupnvLrFRktM0-GvdA","Sidshnu","22","23.28.08","varalakshmi vratham|varalaskshmi vratham pooja|sidshnu|lakshmi pooja|naveena yata|priyanka gowda|pooja vlog|Sidshnu youtube channel|Telugu vlogs|vishnupriya|vishnu priya|siddhardh|sidshnu youtube channel|sidshnu channel|sidshnu serials|serial actress youtube channel|serial actress vishnupriya|serial actress|sidshnu new video|sidshnu new videos|trending video|sidshnu trending vlog|Sidshnu yt channel|vishnu priya videos|vishnupriya latest video","904181","0","0","682","https://i.ytimg.com/vi/K4Zm67P9Z6Y/default.jpg","False","True","#Sidshnu #VishnuPriya #SiddharthVarma #Varalakshmivratam #PriyankagowdaPlease do subscribe to My Channel   @SidshnuOfficial  Powered BY #TamadaMediaFollow us on: https://www.instagram.com/sidshnu/https://www.instagram.com/siddhardhvarma_official/https://www.facebook.com/siddhardhvar...For Brand CollaborationSidishnu@gmail.com#Crazyfamily #MuthyamanthaMuddu #serialactresvishnupriya #trinayani #mallika #hasini #agnipariksha  #telugu #teluguvlogs #serial #artist #vlog #vlogs #youtubeshorts #Siddu #couples #janaki #Janakikalaganeledu #neverending"
"khFbuO4gUi0","గంగవ్వ ఇంట్లో రాఖీ పండుగ | Gangavva Comedy video | Rakhi Festival | My Village Show | Chandu | Anji","2023-08-27T04:58:15Z","UCi7lxgkjW0ilcJDl5XGHr3Q","My Village Show Gangavva","22","23.28.08","gangavva|gangavva comedy|telugu vlogs|gangavva jokes|gangavva vlogs|my village show|my village show comedy|jokes|village show comedy|village show vlogs|village vlogs|telangana lady|old women","437752","0","0","677","https://i.ytimg.com/vi/khFbuO4gUi0/default.jpg","False","True","Actors : Gangavva, Chandhu Sirigiri, Anjimama, Anil Kante, Dharmika, Soujanya, NareshWriter & Director : Gangareddy KotteDOP: Madhu AluvalaEditor: Thirumal GorreSync Sound: PavanExecutive Producer: Prashanth SriramProducer by Srikanth SriramAny promotions Email : brands@myvillageshow.in"
"XBk9OSpB6Cw","మా ఇంటి వరలక్ష్మి వ్రతం || Varalakshmi Vratham || Festival vlog || Naveena Vlogs || Tamada Media","2023-08-27T04:30:09Z","UCSHIuVGOU65gX16_tLr0_IA","NAVEENA ** The Ultimate channel **","22","23.28.08","varalakshmi vratham|varalaskshmi vratham pooja|naveena|lakshmi pooja|naveena yata|priyanka gowda|pooja vlog|Telugu vlogs|vishnupriya|serial actress youtube channel|serial actress naveena|serial actress|naveena new video|trending video|naveena trending vlog|Naveena yt channel","293872","0","0","181","https://i.ytimg.com/vi/XBk9OSpB6Cw/default.jpg","False","True","Neutriderm Amazon Store - https://www.amazon.in/stores/page/E9531BC9-C5A1-42ED-9D8B-215EF36856A7?Dermavive Amazon store - https://www.amazon.in/stores/page/5C4EFDF7-3F6F-481C-B821-1092D1A61409?Pre-makeup skincare combo - https://bit.ly/45whaLqDermavive Moisturising Lotion - https://bit.ly/3EeHEFeDermavive Hydra Cleanser - https://bit.ly/45pdTgNThese Products are also available on Flipkart, 1 mg, Myntra, Firstcry, Purplle——————————————————————————-#Varalakshmivratam #Naveenavlogs #Pooja #Naveenayata #NaveenaFollow me on my Social MediaInstagram : http://instagram.com/naveenayataofficialFor More Updates :Subscribe @ https://bit.ly/2tCXbdq———————————————————————————Instagram Jewelerybysusmitha https://instagram.com/jewelerybysusmitha?igshid=MzRlODBiNWFlZA==What's app number 8367746018https://chat.whatsapp.com/IpskGcBURbr5MEfZq5HvNvYoutube linkhttps://youtube.com/@jewellerybysusmitha8944————————————————————————-/////My saree details here*Material*:Mangalagiri semi tissue pattu*Model*:kanchi border temple kuppatam with butta semi pattu sareesContrast rich pallu and blousehttps://instagram.com/akshithaatrendz?igshid=MzRlODBiNWFlZA==9000226665——————————————————————————FOR BRANDS AND COLLABORATIONS CONTACT yatasmedia@gmail.com——————————————————————————/"
"u17rJhLiYCk","వరలక్ష్మి వ్రతం.. తాంబూలం.. పేరంటం || Haritha Jackie || Haritha Jackie Vlogs || Strikers","2023-08-26T13:10:00Z","UCGLiE4bZSUnly-R-Ij1MiYQ","Haritha Jackie","24","23.28.08","Haritha Jackie|haritha jackie Channel|haritha jackie YouTube Channel|haritha jackie family|haritha jackie Vlogs|haritha jackie Videos|haritha jackie latest videos|haritha latest video|haritha jackie mother|Haritha Jackie daughter|actress Haritha Jackie|Mother birthday celebrations|haritha jackie varalakshmi vratham video|haritha jackie varalakshmi vratham|haritha jackie varalakshmi vratham vlog","523410","0","0","364","https://i.ytimg.com/vi/u17rJhLiYCk/default.jpg","False","True","#HarithaJackie #varalakshmivratam #HarithaJackieVlogs #Strikersవరలక్ష్మి వ్రతం.. తాంబూలం.. పేరంటం || Haritha Jackie || Haritha Jackie Vlogs || StrikersThis video is Produced by #Strikers​​​​​Follow Me Here :Instagram : https://www.instagram.com/harithajackie/------------------------------For Branding and Collaborations:Mail us @ sandeep@strikersdigital.comLinkedIn - https://www.linkedin.com/in/sandeep-miryala-0a348686Call us @ 9553191194"
"_EFaYSR8JWI","Ashish Chanchlani Raids the Netflix Office | Guns & Gulaabs | Netflix India","2023-08-25T08:30:37Z","UCZSNzBgFub_WWil6TOTYwAg","Netflix India","24","23.28.08","Adarsh Gourav|Adarsh Gourav Movie|Dulquer Salmaan|Dulquer Salmaan Movie|Guns & Gulaabs|Guns & Gulaabs Trailer|ashish chanchlani|ashish chanchlani bigg boss|ashish chanchlani diwali|ashish chanchlani exam|ashish chanchlani holi|ashish chanchlani holi video netflix india|ashish chanchlani new|ashish chanchlani reaction|ashish chanchlani shark tank|ashish chanchlani shorts|ashish chanchlani video|ashish chanchlani vines","3466180","0","0","5266","https://i.ytimg.com/vi/_EFaYSR8JWI/default.jpg","False","True","This gangster thinks he is sabse shaana, but will he match up to Tipu’s paana? 🔧Witness Chanchu bhai try to take over Guns & Gulaabs ki duniya! 🌹Guns and Gulaabs now streaming only on Netflix!Follow Netflix India on:Website: https://www.netflix.com/YouTube: http://bit.ly/NetflixIndiaYTInstagram: http://www.instagram.com/netflix_inFacebook: http://www.facebook.com/NetflixINTwitter: http://twitter.com/netflixindiaYouTube Shorts: https://bit.ly/NetflixIndiaShorts#NetflixIndia #AshishChanchlani #GunsandGulaabs"
"yYOAGK2ePcs","College Onam Celebration🌼✨ | Hansika Krishna","2023-08-27T13:20:56Z","UCpKDg5aOsMYn5kWxe7YGdSA","Hansika Krishna","22","23.28.08","[none]","135196","0","0","181","https://i.ytimg.com/vi/yYOAGK2ePcs/default.jpg","False","True","#onam #college #onamcelebration #hansikakrishna"
"iovZPC_KQzw","Reacting to my BIG BOSS FIGHTS😂","2023-08-24T07:45:53Z","UCi5kSELjaJWmnBKPXkTcxsA","FUKRA INSAAN LIVE","24","23.28.08","[none]","6240190","0","0","23805","https://i.ytimg.com/vi/iovZPC_KQzw/default.jpg","False","True","Follow me on Instagram for updates ➞  https://instagram.com/fukra_insaan?igshid=jytojomgh8j4Join my discord server ➞https://discord.gg/Es7PVh4BAKMy twitter ➞ https://twitter.com/AbhishekMalhan4?s=09"
"FKZX4Lo2yCU","||Aniyan Bharya Chettan Bharya||അനിയൻ ഭാര്യ ചേട്ടൻ ഭാര്യ ||malayalam comedy||Dimos kottarakkara||","2023-08-27T08:30:03Z","UC1hWVEOkra5LkP37qI6PVVg","Sanju and Lakshmy","24","23.28.08","[none]","360665","0","0","885","https://i.ytimg.com/vi/FKZX4Lo2yCU/default.jpg","False","True","അനിയന്റെ ഭാര്യയും ചേട്ടന്റെ ഭാര്യയും ഒരുമിച്ച് സാധനം മേടിക്കാൻ കൊണ്ടുപോയ ചേട്ടൻ അനിയന്മാരുടെ അവസ്ഥ 😂😂😂😂😂DIMOS KOTTARAKKARA SREEJITH +91 70259 66661Dimos Econ budget Shafi 7025936665DIMOS KARUNAGAPALLY 90727210339072721012Dimos econ BUDGET KARUNAGAPALLY 9072721118Dimos furniture shops in Kerala  PALLIMUKK Mubas+91 90727 10030Pazhayattinkuzhi KAVITHA92070 19333Dimos international mevaramSAJIN+91 70120 91588Dimos KOTTARAKKARA Sreejith9072727505Dimos Econ KOTTARAKKARA Shafi70259 36665Dimos chanthanathopeArun70259 66664DimosKondotty Saleem88911 23720Dimos Calicut Shihab85900 62276"
"eJqOGr-kp2Q","SCHOOL MEIN RAKSHA BANDHAN || Rachit Rojha","2023-08-25T08:30:21Z","UCwBlZvRTu3vasTWUE9U5wPw","Rachit Rojha","24","23.28.08","[none]","1487456","0","0","2293","https://i.ytimg.com/vi/eJqOGr-kp2Q/default.jpg","False","True","Happy Raksha Bandhan Everyone !! ❤️❤️---------------------------------------------------------------------------------Follow me onInstagram: https://www.instagram.com/rachitrojha---------------------------------------------------------------------------------Script By - Aashish BhardwajDirection - Rachit RojhaSreenplay - Rachit RojhaSchool Location - ( IDPS ,Sector 5,Gurugram )Cast :Rachit Rojha Chinu RojhaSibbu GiriBhawna RojhaLokesh BhardwajSushma Aunty (Dadi)IshaanAishwaryaRitikLakshayShivamAmanAnd TeamShoot By - Insta The DogThumbnail - Raj SharmaThe Rachit Rojha Productions.Managed by-: Sociopool (Sociopool India Private Limited)Business Inquiries-: contact@sociopool.comLike Comment And Share !!"
"uU6T21q3vP0","Village Boy Finale |4K | Village Comedy | Creative Thinks","2023-08-27T05:07:13Z","UC6RpJsr061UxFL8bvI9YW4A","Creative Thinks","24","23.28.08","Telugu|village|village comedy|village culture|village show|the village|comedy|creative thinks|funny|#village|short films|village girl|village people|funny videos|my village|village nature|telugu short films|village fun|telugu funny videos|telugu comedy videos|creative thinks new|creative thinks latest|telugu comedy|chinni|Childhood|sri|Amazing|last","196900","0","0","1650","https://i.ytimg.com/vi/uU6T21q3vP0/default.jpg","False","True","Download Duolingo and scroll down to find Telugu among the many languages: https://app.adjust.net.in/ykh0w65This Is Village Boy Season 🔥This Series is Different and we can Motivate you in fun way 💚Written & Direction : శ్రీCinematography : Sri, Mounika rendlaMusic: G.VaniEditing : Sri, Mounika rendlaPoster design : Rk_ DesignsSubtitles :Contact 👇Email: Creativethinks007@gmail.comలేదా Chat in 👇Facebook Page https://www.facebook.com/CreativethinksofficialFollow Me on Insta  https://www.instagram.com/creative_thinks_sri/Mana  Twitter https://twitter.com/CreativeThinkssమన channel page https://www.instagram.com/creative_thinks_offical/Subscribe to our 2nd channel👇https://www.youtube.com/c/CreativeThinksAtoZమన 3rd channel https://www.youtube.com/c/CreativeThinksAdventureమీ మద్దతు వుంటే నేను మరెన్నో మంచి వీడియోలను చేయగలను 🤗🥰మీ అభిమానానికి నా  హృదయపూర్వక ధన్యవాదాలు 😍😊🙏Copyright © 2014-2023. Creative Thinks. All Rights Reserved."
"aBeGwCu9y2M","RDX: Robert Dony Xavier | My Opinion | Malayalam","2023-08-25T09:31:18Z","UCNhaliLwhGH9wX3pe9bFTbA","LifeofShazzam","22","23.28.08","[none]","947279","0","0","2135","https://i.ytimg.com/vi/aBeGwCu9y2M/default.jpg","False","True",""
