video_id,title,publishedAt,channelId,channelTitle,categoryId,trending_date,tags,view_count,likes,dislikes,comment_count,thumbnail_link,comments_disabled,ratings_disabled,description
"Ohtrd5WMeng","NO ID (OFFICIAL VIDEO) - DEEP KALSI X RAGA | TUNNEL VISION | KALAMKAAR","2023-08-25T06:30:36Z","UC99IVRmbb0vJZ1Vge2HtMHg","Kalamkaar","10","23.28.08","songs|music|music video|rapper|kalamkaar|hip hop music|kalamkaar music|kalamkaar songs|deep kalsi|rap|dhh|dhh rap|desi hip hop|indian rap|raga|no id|deepkalsikesangeetpe|new song|tunnel vision|new music|deepkalsi x raga|raga rapper|raga rap song|raga deep kalsi|no id raga|no id deep kalso|indian rapper|hindi rap|hindi rapper|delhi rap|delhi rapper","703644","0","0","7284","https://i.ytimg.com/vi/Ohtrd5WMeng/default.jpg","False","True","Click here to Subscribe: https://bit.ly/KalamkaarYT Listen to NO ID on all audio stores:-Spotify: https://deepkalsi.bfan.link/no-id/spotifyApple Music: https://deepkalsi.bfan.link/no-id/appleMusicWynk: https://deepkalsi.bfan.link/no-id/wynkResso: https://deepkalsi.bfan.link/no-id/ressoGaana: https://deepkalsi.bfan.link/no-id/gaanaAmazon Music: https://deepkalsi.bfan.link/no-id/amazonMusicJioSaavn: https://deepkalsi.bfan.link/no-id/jiosaavnYouTube Music: https://deepkalsi.bfan.link/no-id/youtubeMusicAudio Credits: Performed by - Deep Kalsi & RagaWritten by - RagaProduced by - Deep KalsiMixed & Mastered by - Ryan SummerVideo Credits: Director, Concept, Editor, DP: Director Grim @directorgrimLine Production: Audvix MediaCreative Director: Amanpreet SinghGaffer: Vidhya SagarStudio: Pinhole StudiosArt & Art Direction -  Arch-ShotStylist - Anshita JainMUA: Anu RajodiaHair Stylist: Sonu BarberCasting by - Salman Films Casting AgencyFollow Deep Kalsi on: Instagram - https://instagram.com/deepkalsimusic?igshid=MzRlODBiNWFlZA==Spotify - https://open.spotify.com/artist/23S2w22FCwFjDBBn7qdB2I?si=SPmuvTBrS6ix59U6fd3X7QFollow Raga on: Instagram - https://instagram.com/officialraga?igshid=MzRlODBiNWFlZA==Spotify - https://open.spotify.com/artist/4MJZBb8KABfKw0gzfgacpO?si=KmZTSqVlRcCLqBt8KfvXgA Follow Director Grim on:Instagram - https://instagram.com/directorgrim?igshid=MzRlODBiNWFlZA==Cover artwork by @the_indiandoodler_ Team Believe Artist Services: https://linktr.ee/believeartistservicesindiaDigital Partner - Believe DigitalFor licensing inquiries - Email - sync-india@believedigital.comFollow us on - Instagram - https://www.instagram.com/kalamkaarmusicWebsite:- http://www.kalamkaarmusic.comAudio on Kalamkaar Music Pvt. Ltd. (C) 2023#Kalamkaar #DeepKalsi #Raga #NOID #Kalamkaar #MusicVideo #Music #Rap #HipHop #DHH #DesiHipHop #newmusic #deepkalsikesangeetpe"
"EiAa6golGq0","Kumkum Bhagya, Kundali Bhagya & Rabb Se Hai Dua -From 28th Aug - फेसोलो का महासप्ता - Promo - Zee TV","2023-08-26T12:19:59Z","UCppHT7SZKKvar4Oc9J4oljQ","Zee TV","24","23.28.08","Zee TV|kumkum bhagya|kundali bhagya|कुमकुम भाग्य|कुंडली भाग्य|Rab Se Hai Dua|रब से है दुआ|Rabb Se Hai Dua|Karanvir Sharma|Aditi Sharma|Richa Rathore|फेसोलो का महासप्ता|ज़ी टीवी|हिन्दी चैनल|general entertainment channel|Hindi GEC TV channel|hindi tv serial|zeetv|hindi serial|show|entertainment|daily soaps|family|drama|promo|zee popular shows","1098470","0","0","245","https://i.ytimg.com/vi/EiAa6golGq0/default.jpg","False","True","Click Here To Watch Full Episodes: https://zee5.onelink.me/RlQq/ade1123eClick Here To Watch Full Episodes ►https://zee5.onelink.me/RlQq/6a4ff918Click Here To Watch Full Episodes: https://zee5.onelink.me/RlQq/bbc8ee41Free Subscription click here: https://bit.ly/SubscribetoZeetv Get notified about our Latest update by Clicking the Bell Icon 🔔Kumkum Bhagya - Torn apart by betrayals and misunderstandings, star-crossed lovers Pragya and Abhi find their circumstances reversed. Rhea returns to wreak havoc in the lives of happily married Ranbeer and Prachi.Kundali Bhagya - Karan marries Preeta out of spite owing to a misunderstanding. Preeta tries to clear the air and wins him over whilst dealing with Sherlyn, Prithvi, and Mahira, a trio that becomes a thorn in her side.Rabb Se Hai Dua - Dua and her husband are a perfect married couple in the eyes of their family. However, Dua’s life turns upside down when her husband seeks her permission to marry another woman.Paid Subscription ZEE5 click here: http://www.zee5.com/myaccount/subscription?plid=0-11-1503&utm_source=yt_zeetv&utm_medium=link_desc&utm_campaign=subscription_lpWatch tomorrow’s Premiere Episodes of ZEE TV serials today. Get the best of ZEE5 Originals, popular Alt Balaji shows, 1000+ superhit movies, favourite Zindagi shows, popular kids entertainment, Live TV channels and more.To Download Free ZEE5 Mobile app click the link below -Playstore: http://bit.ly/Zee5PlayStoreiTunes: http://bit.ly/Zee5ITunesConnect with Zee TV on Social MediaFacebook: http://bit.ly/ZeeTvFBInstagram: http://bit.ly/ZeeTvInstaTwitter: http://bit.ly/ZeeTVtwitterConnect with ZEE5 on Social MediaFacebook: http://bit.ly/Zee5FBInstagram: http://bit.ly/Zee5HindiInstaTwitter: http://bit.ly/Zee5twitter"
"x0y1Tjml_mA","Chitra Saradhi || Episode - 1 || Soniya Singh || Pavan Sidhu || Infinitum Media","2023-08-24T15:15:59Z","UCruMs8kL2fHjxNIymX53VSw","Vayyari Bhama","24","23.28.08","Chitra Saradhi Web series|chitra saradhi web series episode 1|chitra saradhi episode 1|soniya singh|pavan sidhu|soniya singh pavan sidhu short films|soniya singh pavan sidhu|telugu web series|sonia singh short films telugu latest|soniya singh short films|pavan sidhu short films telugu|telugu short films|telugu short films 2023 latest|soniya singh latest|short films telugu 2023 latest|telugu love short films latest|telugu new short films latest|infinitum media","174824","0","0","123","https://i.ytimg.com/vi/x0y1Tjml_mA/default.jpg","False","True","Chitra Saradhi is a Telugu Romcom Web Series featuring Soniya Singh & Pavan Sidhu as leads.Disclaimer: We do not intend to promote investment/gambling of any kind.  Viewer discretion is advised. If your current residence is from Andhra, Assam, Odisha, Telangana, Nagaland, and Sikkim, you are advised to not participate.This activity promotes a game and doesn’t intend to promote any kind of betting/gambling.For Brand Inquiries & Collaborations Email us at brands@infinitumnetwork.inCast: Soniya Singh, Pavan Sidhu, Harshini Balla, Bhanu Prakash.MProduced by Vandana BandaruWritten & Directed by GVKAssociate Director: SreekanthBrands Manager: Bhargav.TCinematography: BhanuEditing:  Venkatesh ChunduruPoster Designer: Nikhil ChotuSound Engineer: Venkat, Bhaskar.Executive Producer: Chandu JC#ChitraSaradhiWebSeries #SoniyaSingh #PavanSidhu #InfinitumMedia Presented by Infinitum Network Solutions.Khiladi is an online gaming app. We do not promote online  betting/gambling. Viewer discretion is advised. Please play at your own risk."
"QYvN9Rh24d4","CORPORATE JOB SCAM | Stand up Comedy by Abijit Ganguly","2023-08-24T13:30:11Z","UCRDJea1PTGSDkt1cvkDoOhg","Abijit Ganguly","23","23.28.08","Abhijit Ganguly Comedy|Abhijeet Ganguly Comedy|Abhijit Ganguly Stand-up|Abhijeet Ganguly Stand-up Comedy|Consulting Humour|Indian Stand-up Comedy|2023 stand-up Comedy Video|New Stand-up Comedy Video|Comedy Videos|MBA Comedy|MBA stand-up COmedy","490173","0","0","417","https://i.ytimg.com/vi/QYvN9Rh24d4/default.jpg","False","True","Releasing a Stand-up bit from my experience in a typical Corporate Job that I had joined post my MBA. Performing some show around. Ticket links to the shows in the link below.Show links: https://linktr.ee/AbijitGangulyInstagram: https://www.instagram.com/abijitgangulyFor show queries, contact on +91 89286 08556 or drop a mail at abijitganguly@gmail.com.Written & Performed by Abijit GangulyVenue Courtesy - Above The Habitat, MumbaiShot by The Habitat Videography Team -  Vivian  Castalino, Harsh Shah, AditiSound Recording by The Habitat Audio TeamPost Production: Myoho FilmsEdit & Grade: Karan AsnaniSound mix and master: Sreejith MenonSpecial thanks to all the colleagues I have had in my life. For contributing to this bit in your own way.#standupcomedy #corporatelife #funnyvideo"
"ZdYz-dc05rY","Winning Moments and Players' Reactions After Incredible Finish in Second ODI 🤩 | PCB | MA2L","2023-08-25T06:12:52Z","UCiWrjBhlICf_L_RK5y6Vrxw","Pakistan Cricket ","17","23.28.08","PCB|Pakistan team|T20I|T20|ODI|Gadaffi Stadium|pakistan cricket board|cricket pakistan|Pakistan Cricket Official|cricket official|pakistan Cricket|Real PCB|Test match|PSL|Pakistani Players|National Stadium|Babar Azam|Pak match Highlights|Pak Live Match|Pakistan Cricket Team|Match Highlights","710476","0","0","1025","https://i.ytimg.com/vi/ZdYz-dc05rY/default.jpg","False","True","Still not over last night's incredible finish❓Revisit the winning moments and reactions of the players after the second ODI 🤩#AFGvPAK | #BackTheBoysInGreen Buy official Pakistan Cricket merchandise:https://shop.pcb.com.pk/Welcome to the official page of Pakistan Cricket Board. Get all your Pakistan Cricket updates here!You can access exclusive player interviews, match highlights, practice sessions, press conferences, coaching videos and other beyond-the-boundary content.Subscribe to our YouTube channel:https://bit.ly/SubscribePakistanCricketLike us on Facebook:https://www.facebook.com/PakistanCricketBoardVisit our website: https://www.pcb.com.pk/"
"H-2ddhMO0eU","Shortest Game of Praggnanandhaa & Magnus Carlsen in World Cup | Finals Game 2","2023-08-23T15:36:48Z","UCIsEhwBMPkRHsEgqYAPQHsA","ChessBase India","17","23.28.08","chessbaseindia|interviews|chesstraining|improvechess|chess|how to play chess","2109412","0","0","1361","https://i.ytimg.com/vi/H-2ddhMO0eU/default.jpg","False","True","Magnus Carlsen made a very solid draw against Rameshbabu Praggnanandhaa with the White pieces. Pragg did not face any troubles with Black - the players agreed to a draw after 30 moves of play in an equal Bishop ending.Since the scores are 1-1 after the 2 classical games, we are going into tiebreaks tomorrow! Who do you think has better chances in the tiebreaks?This tournament is sponsored by Freedom Broker. Check out their websites:https://www.freedomholdingcorp.com/https://ffin.kz/Video: ChessBase India #Chess #ChessBaseIndia #praggnanandhaa #magnuscarlsen #fideworldcup #baku #chessgame #azerbaijan ----------------------------------------------------------------◾ChessBase India channel: https://www.youtube.com/c/ChessBaseIndiachannel◾Support young talents via HelpChess Foundation: https://helpchess.org/◾Review us on Google: https://g.page/r/CZ5T1PaLM-7WEBE/review◾ChessBase India Clips: https://www.youtube.com/channel/UCjYrfY1-CCX2pagdnRrNUpA◾ChessBase India Hindi: https://www.youtube.com/c/ChessBaseIndiaHindi◾Website: http://chessbase.in◾Chess Shop: https://chessbase.in/online-shop/◾Chess Calendar: https://chessbase.in/calendar◾ChessBase India on amazon: https://amzn.to/2vv0XXy◾Twitter: https://twitter.com/ChessbaseIndia◾Facebook: https://www.facebook.com/chessbaseindia/◾Instagram: https://www.instagram.com/chessbaseindia ◾Contact us: chessbaseindia@gmail.com"
"dIyqPoSLSEc","NEW! Barsatein - Mausam Pyar Ka - Ep 35 | 25 Aug 2023 | Teaser","2023-08-25T15:00:35Z","UCpEhnqL0y41EpW2TvWAHD7Q","SET India","24","23.28.08","Shivangi Joshi|Barsatein serial|hindi tv show|बरसातें|Barsatein story|new story|set india|hindi tv serials|Barsatein new|barsatein|barsatein serial|barsatein shivangi joshi|barsatein serial new|barsaatein new show online|barsaatein|barsatein new|barsaatein story|barsatein star cast|barsatein new show|ekta kapoor barsatein|sony tv show barsaatein|barsatein mausam pyaar ka ep 35|teaser|barsatein teaser|Barsatein kushal tandon|barsatein today episode","2017540","0","0","412","https://i.ytimg.com/vi/dIyqPoSLSEc/default.jpg","False","True","Click here to Subscribe to SET India: https://www.youtube.com/channel/UCpEhnqL0y41EpW2TvWAHD7Q?sub_confirmation=1Episode 35: Aradhna's Motivation-----------------------------------------------------------------Ananya Panday and Ayushmann Khuranna arrive at the party and give Aradhna some advice. Meanwhile, Aradhna finds the stolen idols at Malini's house. What will she do now? What will happen now? Will Aradhna be able to keep calm after meeting with Reyansh? Stay tuned to find out what turn Reyansh and Aradhna's life takes.  Show Name: Barsatein - Mausam Pyaar KaCast: Shivangi Joshi, Kushal TandonEpisode: 35Director: Atif KhanProducer: Ekta Kapoor#barsateinmausampyaarka #setindia #बरसातेंमौसमप्यारका #kushaltandon #shivangijoshi About Barsatein - Mausam Pyaar Kaa:------------------------------------------------------------A sensible and ambitious journalist joins a media company run by a suave maverick man. While united in their passion for honest and ground-breaking journalism, their contrasting characters immediately puts them at loggerheads. What will happen when she starts falling in love with him despite the red flags? 'Barsatein - Mausam Pyaar Ka' stars Shivangi Joshi and Kushal Tandon in lead roles.Click here to watch the full episode of Barsatein - Mausam Pyaar Ka:https://www.sonyliv.com/dplnk?schema=sony://asset/1000233695NEW! Barsatein - Mausam Pyar Ka - Ep 35 | 25 Aug 2023 | Teaser"
"QQKSASFdoDw","India Moon landing: Chandrayaan-3 spacecraft lands near south pole - BBC News","2023-08-23T15:20:34Z","UC16niRr50-MSBwiO3YDb3RA","BBC News","25","23.28.08","bbc|bbc news|news|world news|breaking news|us news|world","1106643","0","0","8211","https://i.ytimg.com/vi/QQKSASFdoDw/default.jpg","False","True","India has made history as its Moon mission becomes the first to land in the lunar south pole region.With this, India joins an elite club of countries to achieve a soft landing on the Moon, after the US, the former Soviet Union and China.The Vikram lander from Chandrayaan-3 successfully touched down as planned at 18:04 local time (12:34 GMT).Celebrations have broken out across the country, with Prime Minister Narendra Modi saying India is now on the Moon.Please subscribe here: http://bit.ly/1rbfUog#India #Moon #MoonLanding #BBCNews"
"QyFRJJ3Jrwc","চন্দ্ৰযানৰ বাবে ১৭ মিনিটৰ ভয়! ISROৰ চাৰি বছৰৰ কষ্ট নিৰ্ভৰ কৰিছে ১৭ মিনিট ৩২ ছেকেণ্ডৰ ওপৰত","2023-08-23T11:47:27Z","UCBMgVLD4TaNFiZLNB60WMgg","DY365","25","23.28.08","assamese news live|assamese news channel|assamese news pratidin time|assamese news nrc|assamese news paper|assamese news video|assamese news dy365|assamese news all channel|assameseweekendvlog|pathsala rakh dimpu video|dimpus vlog gangtok|dimpus vlog chennai|technical guruji unboxing|technical guruji giveaway|assamese vlog video|meenakshi gogoi goa vlog|meenakshi gogoi blog|assamese news nrc|assamese news new","435420","0","0","1839","https://i.ytimg.com/vi/QyFRJJ3Jrwc/default.jpg","False","True","চন্দ্ৰযানৰ বাবে ১৭ মিনিটৰ ভয়! ISROৰ চাৰি বছৰৰ কষ্ট নিৰ্ভৰ কৰিছে ১৭ মিনিট ৩২ ছেকেণ্ডৰ ওপৰত। বিজ্ঞানীসকলে নাম দিছে '17 Minutes of Terror'#chandrayaan3 _______________________________The agenda of this channel is neutral, unbiased news. It has no hidden agenda and no personal baggage. A channel grows on its reputation and credibility. With its highly dedicated team of reporters, correspondents, journalists and back up of professional technical team, #DY365 will strive to leave a trail of credibility in every sphere of its work.FEARLESS, UNBIASED, TRUSTWORTHYNEWS BEGINS HERESubscribe to our channel for the latest news updates: https://bit.ly/2lWxmV7Connect on Social Media: Follow Us on Twitter: https://twitter.com/dy365Like Us on Facebook: https://www.facebook.com/dy365Follow Us on Instagram: https://www.instagram.com/dy365.in/Our Website: http://dy365.inSubscribe to our channel '#JONACK' for fictional and non fictional programs, prime time drama series, reality shows, movies , comedy serials, theatrical films, music programs and musical shows, live performance coverage and telecast special and daytime drama etc. :  https://bit.ly/2m1WAShSubscribe to our channel 'NLTV', A Satellite Channel for Exclusive Nagaland News :  https://bit.ly/3ww2xFx"
"G9OPY9BJ8_E","Eating Worlds Most Expensive Mandi 🍗","2023-08-24T13:30:09Z","UCkJfmb163NsCn5RilDm7Q6g","Karthik Surya","22","23.28.08","karthik surya|malayalam vlog|kerala|kerala vlog|trivandrum|ernakulam|malayalam entertainment|entertainment|comedy|peoples and blog|folin.io|karthik surya merch|karthik surya t shirt|karthik surya clothing|dubai|karthik surya dubai|dubai mandi|karthik surya dubai mandi|sabumon|bigboss sabumon|big boss malayalam|worlds most expensive","477429","0","0","789","https://i.ytimg.com/vi/G9OPY9BJ8_E/default.jpg","False","True","BUY MY EXCLUSIVE MERCH: https://folin.io/karthiksuryaWant to send me some goodies? Here’s my address ;)➤ Karthik Surya ProductionsTC 8/2780, Gowri Nandanam, Chellamangalam, Powdikonam P.O, Trivandrum, Kerala Pin:695588.➤ Follow me on social media•https://www.instagram.com/karthiksuryavlogs•https://www.facebook.com/passionuntold/•karthiksuryavlogs@gmail.com➤ Editing:•  @ThatGoofyDude  ➤ My Tags #karthiksurya  #dare2dream   ➤Music Credits: Rhythom"
"P9BhRNMiV3I","Franklin Using Magical Painting To Build The Most Powerful Bike In Gta V ! GTA 5 new","2023-08-24T08:00:12Z","UCp-Y2Xs9UUX-LK8muCMBZEw","Krishna Flight","20","23.28.08","gta|gta 5|gta v|techno gamerz|gta 5 gameplay|gta v gameplay|flight gamer|gta 5 hindi gameplay|chop VS hulk|Franklin Using Magical Painting To Build The Most Powerful Bike In Gta V|franklin gifting|krishna flight|gta v chop|franklin gta 5|chop magical drawing|chop painting monster bike|booster bike|super bike|bike gta v|bike game|bike gta 5|bike gta game|franklin bike|franklin bike game video|superbike gta 5|franklin painting|concept bike","241044","0","0","42","https://i.ytimg.com/vi/P9BhRNMiV3I/default.jpg","False","True","YOU ARE  WATCHING KRISHNA FLIGHT...........Franklin Using Magical Painting To Build The Most Powerful Bike In Gta V_____________________________________________________________INSTAGRAM :-https://www.instagram.com/flightgamer_real------------------------------------------------------------------------------------------------TWITTER :-https://twitter.com/flightgamer22_____________________________________________________________So guys i hope you like this video so plz.. plz.. hit a like button and plz.. share this video everywhere and smash Subscribe button....and press the bell icon...THANK YOU FOR WATCHING.#shinchangta5#gta5mods#modsgta5"
"Pryl0DS0vUc","Chandrayaan 3 Landing வெற்றி.. ISRO அறிவிப்பு | Oneindia Tamil","2023-08-23T12:38:09Z","UCpZBvTbjam0yTrD4HUUWTZw","Oneindia Tamil","25","23.28.08","oneindia tamil|oneindia tamil news|oneindia news|one india tamil|oneindia news channel|oneindia tamil channel|oneindia|oneindia tamil news today|chandrayaan landing video|chandrayaan 3 live landing|chandrayan 3 live landing|chandrayaan 3 landing tamil|chandrayaan landing today|isro chandrayaan landing|chandrayaan 3 landing isro|moon south pole|chandryaan 3 moon landing|chandrayaan 3 mission|chandrayaan 3 today news tamil|chandrayaan 3 tamil","1088606","0","0","591","https://i.ytimg.com/vi/Pryl0DS0vUc/default.jpg","False","True","Join Telegram: https://t.me/oneindia_tamilTo Subscribe Oneindia Arasiyal - https://www.youtube.com/@OneindiaArasiyalOneindia Howzat Facebook : https://www.facebook.com/oneindiahowzatOneindia Infinity Facebook : https://www.facebook.com/oneindiainfinityLike and Follow us on: Facebook : https://www.facebook.com/oneindiatamilvideos Twitter      : https://twitter.com/thatsTamilInstagram: https://www.instagram.com/oneindiatamilofficial ~PR.49~ED.180~HT.73~"
"60lF0C8mI4M","EMIWAY BANTAI (MUMBAI) KOTS LIVE EVENT 9th Sept 2023","2023-08-24T12:30:10Z","UCHmk8iNJHvf5mGN6_pkPc7g","Emiway Bantai","10","23.28.08","[none]","275381","0","0","1979","https://i.ytimg.com/vi/60lF0C8mI4M/default.jpg","False","True","BOOK YOUR TICKETS NOW 🎫https://insider.in/seedha-takeover-kots-live-event-sep-09/event"
"rim6qIxiPFM","Manisha Rani on Abhishek Malhan, Elvish Yadav| REACTS to #Abhisha & #Abhiya fan war| Bigg Boss OTT 2","2023-08-25T12:30:08Z","UCkJZQddO3XTCdcLjN019FjA","PINKVILLA","24","23.28.08","manisha rani|manisha rani jail|manisha rani bigg boss|manisha rani and fukra insaan|manisha rani bigg boss ott|manisha rani father|manisha rani channel|manisha rani papa in bigg boss|manisha rani propose elvish yadav|manisha rani abhishek|manisha rani and bebika fight|abhishek malhan and manisha rani|bigg boss ott 2|bigg boss ott 2 live|bigg boss ott 2 weekend ka vaar|bigg boss ott 2 promo|bigg boss ott 2 live today|bigg boss ott 2 abhishek mom","274033","0","0","1667","https://i.ytimg.com/vi/rim6qIxiPFM/default.jpg","False","True","Manisha Rani, who was a content creator on social media, participated in Salman Khan's Bigg Boss OTT 2 and reached the finale. She emerged as the second runner-up followed by Abhishek Malhan while Elvish Yadav was announced as the winner. After stepping out of the house, the entertainment queen did an exclusive video interview with Pinkvilla, where she reacted to being shamed inside the house, and answered Pooja Bhatt's claims of her not being capable of becoming an actress. Apart from that, Manisha Rani shared her heartfelt feelings about Abhishek Malhan, Elvish Yadav, and Jad Hadid. In addition to the above topics, the Bigg Boss OTT 2 finalist also spoke about #Abhisha and #Abhiya fan wars on Twitter. Watch the entire video.#manisharani  #biggbossott2  #abhishekmalhan  #elvishyadav  #jiyashankar  #tonisha  #abhisha  #abhiya  #elvisha 0:00 - What to expect?0:20 - Introduction1:01 - On #Tonisha and prank call to Tony Kakkar1:48 - On which contestants backstabbed her2:36 - Manisha on #Abhisha and #Abhiya fan war3:54 - On Abhishek and Jiya's bond5:12 - Her reaction to Nischay choosing her as 'bhabhi' over Jiya6:31 - On Pooja Bhatt's claim that Manisha can never be an actress7:21 - About entering Bigg Boss 177:40 - On Elvish Yadav calling her to meet8:23 - About Elvish Yadav's girlfriend9:00 - On her hygiene being questioned in the house10:07 - On being called a male 'attention-seeker'11:38 - Did she meet Bebika Dhurve outside?11:45 - Would she want to bury the hatchet with Bebika?12:03 - Outro The views and opinions expressed in this interview are those of the interviewee and do not reflect the views of Pinkvilla Media Pvt LtdVisit us at:  https://www.pinkvilla.comFollow our social media handles to stay updated with the trendiest buzz in town!Follow Pinkvilla on ReelStar: https://reelstar.app.link/Ga9VCzNj3xbFollow us on Instagram: https://www.instagram.com/pinkvilla/Like us on Facebook: https://www.facebook.com/pinkvillamedia/Follow us on Twitter: https://twitter.com/pinkvillaHindi RushFor the latest Hindi Bollywood and TV updates, you can check out our Hindi handle: https://www.hindirush.com/Follow Hindi Rush on YouTube: https://www.youtube.com/hindirush"
"HcAjTg8fpOM","Miss Shetty Mr Polishetty Telugu Trailer | Anushka Shetty | Naveen Polishetty | Mahesh Babu P","2023-08-21T13:00:25Z","UCmse5JbKneJqVyerfhDVYvQ","UV Creations","24","23.28.08","Miss Shetty Mr Polishetty Telugu Trailer|Anushka Shetty|Naveen Polishetty|Mahesh Babu P|UV Creations|Anushka Shetty MSMP trailer|Miss Shetty Mr Polishetty|Miss Shetty Mr Polishetty Songs|Lady Luck Song|Lady Luck|Radhan|Anushka Shetty Movies|Miss Shetty Mr Polishetty Trailer|MSMP|MSMP Songs|Latest Telugu Movies 2023|Miss Shetty Mr Polishetty Movie|Latest Telugu Movies|Hathavidi Telugu Song|Naveen Polishetty Movies|No No No Song|Anushka Shetty movie trailer","10700656","0","0","2849","https://i.ytimg.com/vi/HcAjTg8fpOM/default.jpg","False","True","Miss Shetty Mr Polishetty Telugu Trailer on UV Creations!Miss Shetty Mr Polishetty is the Latest 2023 Telugu Movie ft. Anushka Shetty and Naveen Polishetty. Music by Radhan & Directed by Mahesh Babu P. Produced by UV Creations.#MissShettyMrPolishettyTrailer #AnushkaShetty #NaveenPolishetty #Radhan #MaheshBabuP #UVCreations #MissShettyMrPolishetty #NiravShah #RajeevanNambiar #GopiSundar #MSMPTrailerReleasing Worldwide In Theaters On September 7th, 2023Movie Details :Movie Name - Miss Shetty Mr PolishettyCast - Anushka Shetty, Naveen PolishettyBanner - UV Creations Produced by: Vamsi-PramodWritten & Directed by: Mahesh Babu PMusic - RadhanBackground Score: Gopi SundarCinematographer - Nirav ShahEditor - Kotagiri Venkateswara RaoArt Director - Rajeevan NambiarSound Design - T. Uday KumarPublicity head - UjwalDigital Partner - Whacked Out MediaMarketing- Walls and TrendsClick here to watch:MSMP Telugu Teaser - https://youtu.be/DoTkzj3wiHEMSMP Tamil Teaser - https://youtu.be/7YMhbdnXlPsMiss Shetty Mr Polishetty Release Date Announcement: https://youtu.be/KoGsyRcSP0gTitle Enti ? , Anushka Shetty & Naveen Polishetty: https://youtu.be/iXYU-8u5tNkAdipurush Official Trailer - Telugu: https://youtu.be/8tea0uI4d2AFollow For More Updates About UV Creations:Like: https://www.facebook.com/UVCTheMovieMakersFollow: https://www.instagram.com/uvcreationsofficial  Follow: https://twitter.com/UV_CreationsSubscribe: https://www.youtube.com/c/UVCreations"
